assay_id,assay_type,description,method,bao_preferred_term,bao_id
1870082,B,Agonist activity at GAL4 DNA binding domain fused glucocorticoid receptor ligand binding domain (unknown origin) at 0.25 to 25 uM by FRET-based assay,FRET-based assay,fluorescence resonance energy transfer,BAO_0000001
1991217,B,Agonist activity at human FXR expressed in human HuH7 cells by luciferase reporter gene assay relative to control,luciferase reporter gene assay,luciferase reporter gene assay,BAO_0002661
2168604,B,Antagonist activity at ERbeta (unknown origin) assessed as inhibition of fluorescein-labelled coactivator PGC1 peptide recruitment at 34 nM incubated for 30 mins by LanthaScreen TR-FRET assay relative to control,LanthaScreen TR-FRET assay,time resolved fluorescence resonance energy transfer,BAO_0000004
643730,B,Antagonist activity at mouse cloned Smo receptor expressed in NIH-3T3 cells co expressing Gli1 binding site after 15 hrs by luciferase reporter gene assay,luciferase reporter gene assay,luciferase reporter gene assay,BAO_0002661
835167,B,Inhibition of FGFR2 by TR-FRET analysis,TR-FRET analysis,time resolved fluorescence resonance energy transfer,BAO_0000004
985206,B,Inhibition of His-thrombin-TEV-tagged cIAP1 BIR3 domain (260 to 352) (unknown origin) after 1 hr by TR-FRET assay,TR-FRET assay,time resolved fluorescence resonance energy transfer,BAO_0000004
1743583,B,Inhibition of human EPHB1 (565 to 984 residues) assessed as residual activity at 500 nM in presence of 33P-ATP by filter binding assay relative to control,filter binding assay,filter assay,BAO_0000401
1565425,B,Inhibition of human His-tagged BRD4 bromodomain 2 expressed in Escherichia coli BL21(DE3)-R3-pRARE2 cells by FRET assay,FRET assay,fluorescence resonance energy transfer,BAO_0000001
700796,B,Inhibition of human MAPKAP-K3 at 10 uM after 60 mins by TR-FRET assay,TR-FRET assay,time resolved fluorescence resonance energy transfer,BAO_0000004
744077,B,Inhibition of MAPK14 at 25 uM by TR-FRET assay,TR-FRET assay,time resolved fluorescence resonance energy transfer,BAO_0000004
811334,B,Inhibition of N-terminal 6-histine tagged Bacillus anthracis LF 263-C terminal catalytic domain using MCA-KKVYPYPME-Dap(Dnp)-NH2 as substrate after 4 hrs by FRET analysis,FRET analysis,fluorescence resonance energy transfer,BAO_0000001
2254352,B,Inhibition of N-terminal thioredoxin-His6 tagged human BCL6 BTB domain (5 to 129 residues) expressed in Escherichia coli BL21-AI incubated for 2 hrs by TR-FRET assay,TR-FRET assay,time resolved fluorescence resonance energy transfer,BAO_0000004
701191,B,Inhibition of p110alpha/p85alpha at 10 uM after 60 mins by TR-FRET assay,TR-FRET assay,time resolved fluorescence resonance energy transfer,BAO_0000004
839971,B,Inhibition of PI3K alpha by continuous TR-FRET assay,continuous TR-FRET assay,time resolved fluorescence resonance energy transfer,BAO_0000004
812850,B,Inhibition of PI3K p110alpha E545K mutant using [gamma33P]ATP by filter binding assay,filter binding assay,filter assay,BAO_0000401
1774531,B,Inhibition of recombinant GST-tagged human PDE9A2 expressed in insect cells using cGMP as substrate after 1 hr by IMAP TR-FRET assay,IMAP TR-FRET assay,IMAP Assay of phosphoproteins (Molecular Devices),BAO_0140036
1869472,B,Inhibition of recombinant human LSD1 (172 to 852 residues) using biotin-labelled H3K4me2 (1 to 24 residues) after 1 hr by TR-FRET assay,TR-FRET assay,time resolved fluorescence resonance energy transfer,BAO_0000004
1463128,B,Intrinsic activity at GAL4 tagged human PPARalpha ligand binding domain expressed in HEK293 cells at 1 uM by luciferase reporter gene assay relative to 1 uM GW2331,luciferase reporter gene assay,luciferase reporter gene assay,BAO_0002661
2123220,B,Positive allosteric modulator activity in mouse kappa opioid receptor stably expressed in HEK293 cell membrane assessed as binding affinity of dyn A1-13 to orthosteric binding site at 0.1 uM coincubated with dyn A1-13 for 90 mins by radioligand competition binding assay,,,
877387,B,Transactivation of GAL4-fused human PPARdelta ligand binding domain transfected in african green monkey COS7 cells by luciferase reporter gene assay,luciferase reporter gene assay,luciferase reporter gene assay,BAO_0002661
1672555,B,Competitive inhibition of human mTOR using 4EBP1 as substrate in presence of [33gammaP]-ATP after 120 mins by filter binding method,filter binding method,filter assay,BAO_0000401
1699332,B,Inhibition of human MSK1 assessed as residual activity at 1 uM in presence of 33P-ATP by filter-binding assay relative to control,filter-binding assay,filter assay,BAO_0000401
518848,B,Inhibition of PDGFRbeta by Ambit binding assay,Ambit binding assay,KINOMEScan assay,BAO_0003011
1870247,B,Binding affinity to ABL2 in SILAC-labeled human MDA-MB-231 cells lysate by mass spectrometry based kinAffinity assay,mass spectrometry based kinAffinity assay,mass spectrometry,BAO_0000055
1708876,B,Binding affinity to AURKB in human NCI-H358 cells at 1 uM by mass spectrometry based pull down assay,mass spectrometry based pull down assay,affinity selection,BAO_0002501
1708876,B,Binding affinity to AURKB in human NCI-H358 cells at 1 uM by mass spectrometry based pull down assay,mass spectrometry based pull down assay,mass spectrometry,BAO_0000055
1992205,B,Binding affinity to BLM in human HCT116 cells cotransfected with DSB model and I-SceI plasmid assessed as reduction in recruitment of protein to DSB site in DNA at 1 uM measured after 24 hrs by chromatin immunoprecipitation assay,chromatin immunoprecipitation assay,immunoprecipitation,BAO_0002508
2163697,B,Binding affinity to FGFR4 (unknown origin) assessed as dissociation constant by competition binding assay,,,
1500556,B,Binding affinity to FLAG-6His-Tev-ATAD2 (950 to 1148) Y1021A/N1064A double mutant (unknown origin) expressed in Escherichia coli BL21 (DE3) by SPR analysis,SPR analysis,surface plasmon resonance,BAO_0000054
651193,B,Binding affinity to GGTase-1 F52Y/Y126T mutant assessed as prenylation of RhoA GTPase by Western blot method,Western blot method,western blot,BAO_0002424
2149103,B,Binding affinity to Grb2-SH2 domain (unknown origin) by ELISA,ELISA,ELISA,BAO_0000134
1708761,B,Binding affinity to HAX1 in human NCI-H358 cells at 1 uM by mass spectrometry based pull down assay,mass spectrometry based pull down assay,affinity selection,BAO_0002501
1708761,B,Binding affinity to HAX1 in human NCI-H358 cells at 1 uM by mass spectrometry based pull down assay,mass spectrometry based pull down assay,mass spectrometry,BAO_0000055
2248318,B,Binding affinity to His6-fused BRD3 BD2 (unknown origin) assessed as change in melting temperature at 100 uM incubated for 30 mins by thermal shift assay,thermal shift assay,thermal shift assessment method,BAO_0040024
1588202,B,Binding affinity to His6-tagged human recombinant SMARCA2B bromodomain expressed in Escherichia coli BL21(DE3)-R3-pRARE2 cells by VP-ITC microcalorimetry,VP-ITC microcalorimetry,VP-ITC Isothermal Titration Calorimeter,BAO_0000708
2069197,B,Binding affinity to HPGDS (unknown origin) assessed as change in melting temperature by thermal shift assay,thermal shift assay,thermal shift assessment method,BAO_0040024
887349,B,Binding affinity to human cyclophilin A by fluorescence polarization assay,fluorescence polarization assay,fluorescence polarization,BAO_0000003
2090202,B,Binding affinity to human full length N-terminal GST-tagged HDAC4 by surface plasmon resonance analysis,surface plasmon resonance analysis,surface plasmon resonance,BAO_0000054
1724121,B,Binding affinity to human GABAA receptor alpha1beta3gamma2 expressed in HEK293 TetR cells assessed as photolabeling at 0.7 uM after 30 mins in presence of 300 uM GABA by coomassie blue staining based fluorographic method,coomassie blue staining based fluorographic method,Coomassie dye protein staining,BAO_0002464
1802989,B,Binding affinity to human His-tagged MOF by SPR analysis,SPR analysis,surface plasmon resonance,BAO_0000054
2122060,B,Binding affinity to human MAP3K2 at 1 uM by KINOMEscan scanMAX assay relative to control,KINOMEscan scanMAX assay,KINOMEScan assay,BAO_0003011
1701466,B,Binding affinity to human N-terminal MDMx (1 to 134 residues) expressed in Escherichia coli BL21 (DE3) after 15 mins in presence of 5-FAM-LTFEHYWAQLTS by FP assay,FP assay,fluorescence polarization,BAO_0000003
1792441,B,Binding affinity to human partial length KIT V559D/V654A double mutant (Y545 to D952 residues) expressed in bacterial expression system assessed as remaining unbound target protein level at 1000 nM by Kinomescan method relative to control,Kinomescan method,KINOMEScan assay,BAO_0003011
1874045,B,Binding affinity to human partial length PIK3CA E545A mutant (R108 to N1068 residues) expressed in mammalian expression system measured after 1 hr by kinomescan method,kinomescan method,KINOMEScan assay,BAO_0003011
1277119,B,Binding affinity to human recombinant TLR4 at >320 uM by SPR method,SPR method,surface plasmon resonance,BAO_0000054
1502837,B,Binding affinity to KAT2A in human HUT78 cells incubated for 45 mins by mass spectrometry based bromosphere chemoproteomic assay,mass spectrometry based bromosphere chemoproteomic assay,mass spectrometry,BAO_0000055
1708895,B,Binding affinity to MAP2K2 in human NCI-H358 cells at 1 uM by mass spectrometry based pull down assay,mass spectrometry based pull down assay,affinity selection,BAO_0002501
1708895,B,Binding affinity to MAP2K2 in human NCI-H358 cells at 1 uM by mass spectrometry based pull down assay,mass spectrometry based pull down assay,mass spectrometry,BAO_0000055
798461,B,Binding affinity to N-terminus biotinylated human Hsp90 alpha by surface plasmon resonance assay,surface plasmon resonance assay,surface plasmon resonance,BAO_0000054
1329392,B,Binding affinity to NR4A1 (unknown origin) at 0.1 uM by luciferase reporter gene assay relative to control,luciferase reporter gene assay,luciferase reporter gene assay,BAO_0002661
1475233,B,Binding affinity to RPA70N protein (unknown origin) by HSQC NMR-based titration method,HSQC NMR-based titration method,nuclear magnetic resonance,BAO_0000160
1475233,B,Binding affinity to RPA70N protein (unknown origin) by HSQC NMR-based titration method,HSQC NMR-based titration method,titration method,BAO_0002413
1880975,B,Binding affinity to wild-type human full length DRAK2 (M1 to C372 residues) expressed in bacterial expression system assessed as residual binding level at 1 uM by Kinomescan method relative to control,Kinomescan method,KINOMEScan assay,BAO_0003011
1741239,B,Binding affinity to wild-type human full length DYRK2 (M1 to S528 residues) expressed in mammalian expression system assessed as residual binding at 1 uM by Kinomescan method relative to control,Kinomescan method,KINOMEScan assay,BAO_0003011
1857117,B,Binding affinity to wild-type human full length DYRK2 (M1 to S528 residues) expressed in mammalian expression system assessed as residual binding level at 1 uM by Kinomescan method relative to control,Kinomescan method,KINOMEScan assay,BAO_0003011
1773707,B,Binding affinity to wild-type human full length ERK2 (M1 to S360 residues) expressed in bacterial expression system assessed as residual binding level at 1 uM by Kinomescan method relative to control,Kinomescan method,KINOMEScan assay,BAO_0003011
1857182,B,Binding affinity to wild-type human full length GRK3 (M1 to L688 residues) expressed in mammalian expression system assessed as residual binding level at 1 uM by Kinomescan method relative to control,Kinomescan method,KINOMEScan assay,BAO_0003011
1773879,B,Binding affinity to wild-type human full length PHKG1 (M1 to Y387 residues) expressed in bacterial expression system assessed as residual binding level at 1 uM by Kinomescan method relative to control,Kinomescan method,KINOMEScan assay,BAO_0003011
1889839,B,Binding affinity to wild-type human full length SRPK1 (M1 to S655 residues) expressed in bacterial expression system assessed as residual binding level at 10 uM by Kinomescan method relative to control,Kinomescan method,KINOMEScan assay,BAO_0003011
1881035,B,Binding affinity to wild-type human partial length autoinhibited FLT3 (H564 to Y969 residues) expressed in mammalian expression system assessed as residual binding level at 1 uM by Kinomescan method relative to control,Kinomescan method,KINOMEScan assay,BAO_0003011
1750933,B,Binding affinity to wild-type human partial length BMPR1A (Q214 to I532 residues) expressed in Escherichia coli BL21 at 1 uM by Kinomescan method relative to control,Kinomescan method,KINOMEScan assay,BAO_0003011
1889510,B,Binding affinity to wild-type human partial length CHEK1 (M1 to G289 residues) expressed in bacterial expression system assessed as residual binding level at 10 uM by Kinomescan method relative to control,Kinomescan method,KINOMEScan assay,BAO_0003011
1889540,B,Binding affinity to wild-type human partial length DMPK2 (S46 to S408 residues) expressed in bacterial expression system assessed as residual binding level at 10 uM by Kinomescan method relative to control,Kinomescan method,KINOMEScan assay,BAO_0003011
1833370,B,Binding affinity to wild-type human partial length EPHA3 (D604 to K889 residues) expressed in bacterial expression system assessed as residual binding level at 1 uM by Kinomescan method relative to control,Kinomescan method,KINOMEScan assay,BAO_0003011
1833461,B,Binding affinity to wild-type human partial length LYN (C219 to Q511 residues) expressed in bacterial expression system assessed as residual binding level at 1 uM by Kinomescan method relative to control,Kinomescan method,KINOMEScan assay,BAO_0003011
1792617,B,Binding affinity to wild-type human partial length N-terminal RSK4 kinase domain 1 (M1 to E397 residues) expressed in mammalian expression system assessed as remaining unbound target protein level at 1000 nM by Kinomescan method relative to control,Kinomescan method,KINOMEScan assay,BAO_0003011
1751186,B,Binding affinity to wild-type human partial length NEK9 (P32 to R328 residues) expressed in Escherichia coli BL21 at 1 uM by Kinomescan method relative to control,Kinomescan method,KINOMEScan assay,BAO_0003011
1805757,B,Binding affinity to wild-type human partial length PDGFRA (V575 to D1002 residues) expressed in mammalian expression system assessed as enzyme remaining activity at 1 uM by Kinomescan assay relative to control,Kinomescan assay,KINOMEScan assay,BAO_0003011
1792559,B,Binding affinity to wild-type human partial length PIKFYVE (F1512 to C2098 residues) expressed in mammalian expression system assessed as remaining unbound target protein level at 1000 nM by Kinomescan method relative to control,Kinomescan method,KINOMEScan assay,BAO_0003011
1741481,B,Binding affinity to wild-type human partial length PRKCI (H215 to V587 residues) expressed in mammalian expression system assessed as residual binding at 1 uM by Kinomescan method relative to control,Kinomescan method,KINOMEScan assay,BAO_0003011
1889827,B,Binding affinity to wild-type human partial length SBK1 (P23 to P348 residues) expressed in mammalian expression system assessed as residual binding level at 10 uM by Kinomescan method relative to control,Kinomescan method,KINOMEScan assay,BAO_0003011
1774008,B,Binding affinity to wild-type human partial length ULK2 (M1 to S301 residues) expressed in mammalian expression system assessed as residual binding level at 1 uM by Kinomescan method relative to control,Kinomescan method,KINOMEScan assay,BAO_0003011
1708497,B,Binding affinity to YWHAQ in human NCI-H23 cells at 1 uM by mass spectrometry based pull down assay,mass spectrometry based pull down assay,affinity selection,BAO_0002501
1708497,B,Binding affinity to YWHAQ in human NCI-H23 cells at 1 uM by mass spectrometry based pull down assay,mass spectrometry based pull down assay,mass spectrometry,BAO_0000055
1923667,B,Binding affinity to zanamivir/oseltamivir resistant recombinant Influenza A virus (A/Moscow/10/99(H3N2)) Neuraminidase N2 E119V/I222L double mutant expressed in baculovirus infected insect cells assessed as dissociation rate constant measured up to 400 sec by surface plasmon resonance analysis,surface plasmon resonance analysis,surface plasmon resonance,BAO_0000054
1908752,B,Covalent binding affinity to human GRK5 assessed as covalent bond formation with Cys474 by intact protein mass spectrometry,intact protein mass spectrometry,mass spectrometry,BAO_0000055
1555070,B,"Displacement of 5-(Dimethylamino)-2-(6-((5-(4-(4-methylpiperidin-1-yl)butyl)-5,6,7,8-tetrahydronaphthalen-2-yl)oxy)hexyl)isoindoline-1,3-dione from sigma 1 receptor (unknown origin) expressed in MCF7 after 75 mins by flow cytometry",flow cytometry,flow cytometry,BAO_0000005
1844861,B,Displacement of 6N-FAM from SF1 LBD (218 to 461 residues) (unknown origin) expressed in Escherichia coli BL21 pLysS by competitive binding based fluorescence polarization assay,fluorescence polarization assay,fluorescence polarization,BAO_0000003
1707368,B,Displacement of biotinylated histone H3K14 peptide ligand from human recombinant His-tagged BRD4 bromodomain-1 measured after 10 mins by TR-FRET assay,TR-FRET assay,time resolved fluorescence resonance energy transfer,BAO_0000004
1582085,B,Displacement of biotinylated ligand from recombinant His-tagged EP300 (unknown origin) incubated for 10 mins by TR-FRET assay,TR-FRET assay,time resolved fluorescence resonance energy transfer,BAO_0000004
572761,B,Displacement of F-BakBH3 from Bfl-1 by fluorescence polarization assay,fluorescence polarization assay,fluorescence polarization,BAO_0000003
1767769,B,Displacement of FAM-labeled HIF-1alpha peptide from VBC (unknown origin) by fluorescence polarization assay,fluorescence polarization assay,fluorescence polarization,BAO_0000003
2074786,B,Displacement of FITC-WFYpSPFLE from human Pin1 (45-163) catalytic domain by fluorescence polarization assay,fluorescence polarization assay,fluorescence polarization,BAO_0000003
1464501,B,Displacement of S6c from rat ETB receptor after 1 hr by Lowry method,Lowry method,Lowry assay,BAO_0002465
1578808,B,Inhibition of human SRPK3 (41 to 567 amino acid residues) expressed in bacterial system assessed as enzyme activity at 10 uM by KINOMEScan assay,KINOMEScan assay,KINOMEScan assay,BAO_0003011
1634426,B,Stabilization of BRAF in human K562 cells after 1 hr by thermal shift assay,thermal shift assay,thermal shift assessment method,BAO_0040024
159810,B,Apparent binding constant was determined by ethidium displacement assay in poly (dG-dC),ethidium displacement assay,ethidium bromide DNA staining,BAO_0002474
1929784,B,Binding affinity to calf thymus duplex DNA assessed as induction of ellipticity at 25 to 200 uM in pH 8.9 phosphate buffer by circular dichroism method,circular dichroism method,circular dichroism,BAO_0000161
745305,B,Binding affinity to human telomeric (5'-FAM-GGG TTA GGG TTA GGG TTA GGG-TAMRA-3') DNA assessed as concentration required to cause half maximal change in melting temperature by FRET-melting assay (Rvb = 59.4 degC),FRET-melting assay,fluorescence resonance energy transfer,BAO_0000001
1983677,B,Binding affinity to SOX2 promoter 5'-CTTTGTT-3' DNA in mouse Hepa1 cells assessed as reduction in SOX2 mRNA expression incubated for 48 hrs by qRT-PCR analysis,qRT-PCR analysis,quantitative PCR,BAO_0003031
2125288,B,Binding affinity to telomeric Htg24 G-quadruplex DNA G17A mutant (unknown origin) assessed as negative fluorescence signal at 5 uM under pH condition 7.4 by fluorescence titration analysis,fluorescence titration analysis,fluorescence method,BAO_0000046
2125288,B,Binding affinity to telomeric Htg24 G-quadruplex DNA G17A mutant (unknown origin) assessed as negative fluorescence signal at 5 uM under pH condition 7.4 by fluorescence titration analysis,fluorescence titration analysis,titration method,BAO_0002413
802309,B,Binding affinity at 5-HT2A receptor by radioligand displacement assay,,,
1278477,B,Binding affinity to human 5-HT3A receptor W90C mutant after 24 hrs by liquid scintillation counting analysis,liquid scintillation counting analysis,scintillation counting,BAO_0000405
966209,B,Binding affinity to human adenosine A1 receptor by radioligand displacement assay,,,
963174,B,Binding affinity to human dopamine D1 receptor by radioligand binding assay,,,
964384,B,Binding affinity to human MC4 receptor at 10 uM by radioligand displacement assay relative to control,,,
1632014,B,Binding affinity to rat M2 receptor by radio-ligand binding assay,,,
1673874,B,"Displacement of [125I]-[Nle75, Tyr77] Pyr1-apelin-13 from YFP-tagged human APJ receptor expressed in HEK293 cell membranes after 1 hr by gamma-counting method",gamma-counting method,scintillation counting,BAO_0000405
1996342,B,Displacement of [125I]-NDP-alpha-MSH from human MC4R expressed in CHO-K1 cell membranes incubated for 3 hrs by top-count beta counting relative to control,top-count beta counting,scintillation counting,BAO_0000405
1737421,B,Displacement of [125I]CCK-8s from human recombinant CCK1 receptor at 10 uM after 60 mins by scintillation counting analysis relative to control,scintillation counting analysis,scintillation counting,BAO_0000405
559547,B,"Displacement of [3H] 2-((1R,2R,5R)-5-hydroxy-2-(3-hydroxypropyl)cyclohexyl)-5-(2-methyloctan-2-yl)phenol from human CB2 receptor expressed CHO-K1 cells by liquid scintillation counting",liquid scintillation counting,scintillation counting,BAO_0000405
2085047,B,"Displacement of [3H]-(S)-2-(6-((2',6'-dimethyl-4'-(3-(methylsulfonyl)propoxy)biphenyl-3-yl)methoxy)-2,3-dihydrobenzofuran-3-yl)acetic acid from human recombinant full-length GPR40 expressed in human HEK293 cell membrane assessed as Koff rate measured after 2 hrs by radioligand competitive assay",,,
775804,B,Displacement of [3H]-epibatidine from alpha1betagammadelta nAChR in human TE671 cellular membranes at 5 uM after 2 hrs by liquid scintillation counting,liquid scintillation counting,scintillation counting,BAO_0000405
1757987,B,Displacement of [3H]-GR65630 from human 5-HT3 receptor expressed in HEKT cells after 90 mins by microbeta scintillation counting analysis,microbeta scintillation counting analysis,scintillation counting,BAO_0000405
1329184,B,Displacement of [3H]-pentazocine from human recombinant sigma-1 receptor expressed in CHO cells after 180 mins by beta counting analysis,beta counting analysis,scintillation counting,BAO_0000405
2132583,B,Displacement of [3H]-SCH23390 from D3 receptor (unknown origin) expressed in HEK293T cell membranes measured after 2 hrs by microbeta scintillation counting method,microbeta scintillation counting method,scintillation counting,BAO_0000405
638891,B,Displacement of [3H](+)-pentazocine from sigma1 opioid receptor from guinea pig brain cortex at 1 uM after 150 mins by scintillation counting,scintillation counting,scintillation counting,BAO_0000405
1864044,B,Displacement of [3H]4-DAMP from recombinant human M3 receptor after 60 mins by scintillation counting analysis,scintillation counting analysis,scintillation counting,BAO_0000405
1711349,B,Displacement of [3H]BRL 43694 from human recombinant 5-HT3 receptor at 10 uM after 120 mins by scintillation counting analysis relative to control,scintillation counting analysis,scintillation counting,BAO_0000405
969677,B,Displacement of [3H]Citalopram from SERT in Sprague-Dawley rat brain homogenate after 60 mins by scintillation counting analysis,scintillation counting analysis,scintillation counting,BAO_0000405
1881838,B,Displacement of [3H]CP 55940 from human recombinant CB1 receptor at 10 uM after 120 mins by scintillation counting analysis relative to control,scintillation counting analysis,scintillation counting,BAO_0000405
1565155,B,Displacement of [3H]CP55940 from CB1 receptor in Wistar rat brain incubated for 60 mins by radioactive filter binding assay,radioactive filter binding assay,filter assay,BAO_0000401
2074736,B,Displacement of [3H]CP55940 from human CB1R transfected in HEK293EBNA cell membranes incubated for 90 mins by Microbeta TriLux based luminescence analysis,Microbeta TriLux based luminescence analysis,MicroBeta TriLux,BAO_0003094
2074736,B,Displacement of [3H]CP55940 from human CB1R transfected in HEK293EBNA cell membranes incubated for 90 mins by Microbeta TriLux based luminescence analysis,Microbeta TriLux based luminescence analysis,luminescence method,BAO_0000045
1930260,B,Displacement of [3H]diprenorphine from rat delta opioid receptor expressed in rat C6 cell membranes measured after 1 hr by liquid scintillation counting method,liquid scintillation counting method,scintillation counting,BAO_0000405
976681,B,Displacement of [3H]DPCPX from human adenosine A1 receptor expressed in CHO cells up to 0.1 mM after 2 hrs by scintillation counting analysis,scintillation counting analysis,scintillation counting,BAO_0000405
2068291,B,Displacement of [3H]DTG from sigma 2 receptor in rat PC12 cells incubated for 120 mins in presence of [3H]-(+)-pentazocine by liquid scintillation counting method,liquid scintillation counting method,scintillation counting,BAO_0000405
764674,B,Displacement of [3H]Iloprost from human prostanoid IP receptor expressed in CHO cells after 60 mins by liquid scintillation counting,liquid scintillation counting,scintillation counting,BAO_0000405
642096,B,Displacement of [3H]methylspiperone from human cloned 5HT2A receptor expressed in HEK293 cells at 1 uM after 90 mins by liquid scintillation counting,liquid scintillation counting,scintillation counting,BAO_0000405
1724104,B,Displacement of [3H]muscimol from human GABAA receptor alpha1beta3gamma2 expressed in HEK293 TetR cell membranes after 1 hr by liquid scintillation counting method,liquid scintillation counting method,scintillation counting,BAO_0000405
