assay_id,assay_type,description,method,bao_preferred_term,bao_id
147295,B,"Ability to stimulate binding to delta-opioid receptor using GTP-gamma -S-binding assay in guinea pig caudate membranes, blocked with 20 nM naltrindole (NTI); NS= no stimulation",GTP-gamma -S-binding assay,,
1987633,F,Anti-urolithic activity in synthetic urine assessed as decrease in absorbance at 10 mg/mL relative to control,,,
1730151,F,Antagonist activity at CCR10 in human MDA-MB-231 cells assessed as inhibition of CCL27-induced proliferation up to 10 uM preincubated for 2 hrs followed by CCL27 addition measured after 48 hrs by MTT assay,MTT assay,MTT reduction assay,BAO_0002457
1525752,F,Agonist activity at dopamine D4 receptor (unknown origin) expressed in CHO cells assessed as calcium mobilization at 3 uM,,,
820807,F,Agonist activity at human S1P3 receptor expressed in CHO cells coexpressing Gq/i5 G-protein assessed as Ca2+ mobilization after 60 to 90 mins by FLIPR assay relative to 1-(4-(6-benzylbenzofuran-2-yl)-3-fluorobenzyl)azetidine-3-carboxylic acid,FLIPR assay,FLIPR Membrane Potential Assay Kit,BAO_0003088
790543,F,Inhibition of basal activity of human histamine H3 receptor expressed in CHO cells assessed as inhibition of RAHM-induced [35S]GTPgammaS binding after 4 hrs by beta liquid scintillation counting,beta liquid scintillation counting,scintillation counting,BAO_0000405
642034,F,Agonist activity at human C3a receptor in human U937 cells assessed as induction of intracellular calcium release,,,
649008,F,Agonist activity at muscarinic M4 receptor in wild type mouse hippocampal CA1 pyramidal neuron assessed as increase in carbachol-induced reduction in excitatory postsynaptic current at 5 uM by whole-cell electrophysiology relative to control,whole-cell electrophysiology,electrophysiological method,BAO_0000424
1839334,F,Modulation of M2 polarization in mouse RAW264.7 cells assessed as up regulation of PPARGC1A mRNA expression at 300 nM measured after 24 hrs by qRT-PCR analysis,qRT-PCR analysis,quantitative reverse transcription PCR,BAO_0002090
2232845,F,Antibacterial activity against methicillin-resistant Staphylococcus aureus assessed as bacterial growth inhibition incubated for 5 hrs under shaking condition by resazurin dye based assay,resazurin dye based assay,resazurin reduction assay,BAO_0002459
2146152,F,Antibacterial activity against Acinetobacter baumannii ATCC 17961 assessed as inhibition of bacterial growth after 16 hrs by two fold dilution method,two fold dilution method,dilution method,BAO_0002418
1836348,F,Antibacterial activity against carbapenem-resistant Escherichia coli BAA-2469 clinical isolates after 18 to 20 hrs in aerobic condition by CLSI-based broth microdilution assay,CLSI-based broth microdilution assay,dilution method,BAO_0002418
1799294,F,Bactericidal activity against methicillin-sensitive Pseudomonas aeruginosa PAO1 at 400 uM after 18 hrs by resazurin-dye based fluorescence assay,resazurin-dye based fluorescence assay,resazurin reduction assay,BAO_0002459
1795430,F,Antibacterial activity against Arcobacter butzleri after 17 hrs by NCCLS broth microdilution method,NCCLS broth microdilution method,dilution method,BAO_0002418
1690980,F,Antibacterial activity against Escherichia coli MTCC 443 after 24 hrs by broth microdilution method,broth microdilution method,dilution method,BAO_0002418
1679715,F,Antibacterial activity against Bacillus subtilis NBRC 13719 after overnight incubation by microdilution method,microdilution method,dilution method,BAO_0002418
1564255,F,Antibacterial activity against Pseudomonas aeruginosa PAO1 clinical isolate assessed as inhibition of biofilm formation at 4 ug/ml after 18 to 22 hrs by crystal violet staining-based polystyrene microtiter plate reader method in presence of 0.5 ug/ml colistin,crystal violet staining-based polystyrene microtiter plate reader method,crystal violet staining,BAO_0002468
1525254,F,Antibacterial activity against methicillin-resistant Staphylococcus aureus ATCC 43300 after 18 to 24 hrs by spectrophotometric analysis,spectrophotometric analysis,spectrophotometry method,BAO_0000049
1438531,F,Antibacterial activity against erythromycin-susceptible Staphylococcus aureus by agar microdilution method,agar microdilution method,dilution method,BAO_0002418
948159,F,"Antibacterial activity against methicillin-susceptible, MLS-resistant (inducible) Staphylococcus epidermidis E1 by broth microdilution method",broth microdilution method,dilution method,BAO_0002418
936279,F,Bactericidal activity against Salmonella typhi after 72 hrs by serial subcultivation method,serial subcultivation method,dilution method,BAO_0002418
790861,F,Antibacterial activity against erythromycin-sensitive Staphylococcus aureus ATCC 13709 by broth microdilution method,broth microdilution method,dilution method,BAO_0002418
724668,F,Antibacterial activity against 1 x 10'4 CFU Streptococcus pneumoniae ATCC 6305 after 18 hrs by CLSI 2-fold agar dilution method,CLSI 2-fold agar dilution method,dilution method,BAO_0002418
695454,F,Antibacterial activity against Salmonella enterica serovar Enteritidis assessed as percent susceptible isolates by broth microdilution method,broth microdilution method,dilution method,BAO_0002418
526824,F,Antibacterial activity against Staphylococcus epidermidis NCIMB 8853 by microdilution method,microdilution method,dilution method,BAO_0002418
1477470,F,Antimicrobial activity against Bacillus subtilis ATCC 6633 after 24 hrs by twofold dilution method,twofold dilution method,dilution method,BAO_0002418
1461117,F,Antimicrobial activity against Bacillus subtilis ATCC 6633 assessed as inhibition of microbial growth incubated for 24 hrs by broth dilution method,broth dilution method,dilution method,BAO_0002418
735749,F,Antibacterial activity against Salmonella by broth macrodilution method,broth macrodilution method,dilution method,BAO_0002418
719615,F,Antimicrobial activity against Enterococcus faecalis ATCC 29212 by broth microdilution method,broth microdilution method,dilution method,BAO_0002418
691129,F,Antimicrobial activity against Staphylococcus epidermidis C960 by broth microdilution method,broth microdilution method,dilution method,BAO_0002418
2214320,F,Antibiofilm activity against vancomycin-intermediate Staphylococcus aureus ATCC 700699 assessed as inhibition of biofilm formation incubated for 24 hrs by crystal violet staining based assay,crystal violet staining based assay,crystal violet staining,BAO_0002468
645376,F,"Antimicrobial activity against Beta-lactamase-negative, ampicillin-resistant Haemophilus influenzae with Ile449Val, Asn526Lys substitutions in penicillin-binding protein 3 by broth microdilution method",broth microdilution method,dilution method,BAO_0002418
1731240,F,Antifungal activity against Candida albicans ATCC 90028 assessed as inhibition of metabolic activity at 10 ug/ml after 48 hrs in presence of 80 ug/ml fluconazol by XTT assay relative to control,XTT assay,XTT reduction assay,BAO_0002458
916663,F,Antifungal activity against Rhizoctonia solani SRRC 1443 assessed as thin hyphae at 20 uM after 48 hr by microscopic analysis,microscopic analysis,microscopy,BAO_0002526
848248,F,Antifungal activity against Aspergillus fumigatus ATCC 26934 by NCCLS broth microdilution method,NCCLS broth microdilution method,dilution method,BAO_0002418
801636,F,Antifungal activity against Penicillium funiculosum ATCC 36839 treated for 72 hrs followed by sub-cultivated for 5 days by serial dilution method,serial dilution method,dilution method,BAO_0002418
522532,F,Antifungal activity against Candida tropicalis isolate 0022-021 after 24 hrs by CLSI M27-A2 broth microdilution method in presence of RPMI 1640 medium,CLSI M27-A2 broth microdilution method,dilution method,BAO_0002418
732024,F,Antimicrobial activity against 5-fluorocytosine resistant Candida glabrata isolate TE34-78 harboring Fcr1 L136R mutant assessed as lowest concentration inhibiting growth >=80% by broth microdilution method,broth microdilution method,dilution method,BAO_0002418
990003,F,Trypanocidal activity against bloodstream forms of Trypanosoma brucei brucei Lister 427 clone 221a after 72 hrs by AlamarBlue assay,AlamarBlue assay,alamarBlue,BAO_0100002
978205,F,Trypanocidal activity against epimastigote stage of Trypanosoma cruzi Y at 5 ug/mL after 72 hrs by MTT assay relative to control,MTT assay,MTT reduction assay,BAO_0002457
672622,F,Antiplasmodial activity against Plasmodium falciparum D10 ATCC 563 after 72 hrs by SYBR green assay,SYBR green assay,SYBR Green I DNA staining,BAO_0002473
2064349,F,Antiviral activity against HCV J6/JFH/JC1 harboring D168V mutant infected in human Huh7.5 cells assessed as inhibition of viral replication measured after 72 hrs by qRT-PCR analysis,qRT-PCR analysis,quantitative reverse transcription PCR,BAO_0002090
1930399,F,Antiviral activity against wild-type HIV1 NL4-3 infected infected in human MT2 cells assessed as reduction in extracellular RNA at 1 uM and measured after 30 hrs post infection by Alu-LTR PCR protocol based method,Alu-LTR PCR protocol based method,real-time PCR ,BAO_0002084
1478223,F,Antiviral activity against Hepatitis C virus genotype 1b Con 1 infected in human HuH7 cells at 40 nM after 72 hrs by luciferase assay in presence of 24 nM simeprevir,luciferase assay,luciferase reporter gene assay,BAO_0002661
725903,F,Antiviral activity against Hepatitis C virus subtype 1b expressing NS3 R155K mutant infected in HuH7 cells after 48 hrs by by luciferase reporter assay,luciferase reporter assay,luciferase reporter gene assay,BAO_0002661
671559,F,Antiviral activity against Influenza A virus (A/Hong Kong/1073/99(H9N2)) infected in MDCK cells assessed as log reduction in viral titer at 960 uM after 48 hrs by MTT assay,MTT assay,MTT reduction assay,BAO_0002457
894707,F,Induction of ultrastructure damage of root tip statocytes in Zea mays (maize) seedlings assessed as reduction in organelle size at 400 ug/L measured 48 hr post dose by transmission electron microscopy,transmission electron microscopy,transmission electron microscopy,BAO_0000455
475911,F,Effect on Phorbol 12-myristate 13-acetate-induced macropinocytosis in mouse J774 macrophage cells at 20 uM by video microscopy,video microscopy,microscopy,BAO_0002526
2054653,F,Induction of ROS-mediated apoptosis in human SGC-7901 cells assessed as early apoptotic cells at 1 uM incubated for 48 hrs by annexin V-PE and 7-AAD staining based flow cytometry analysis (Rvb = 1.89 %),annexin V-PE and 7-AAD staining based flow cytometry analysis,flow cytometry,BAO_0000005
2054653,F,Induction of ROS-mediated apoptosis in human SGC-7901 cells assessed as early apoptotic cells at 1 uM incubated for 48 hrs by annexin V-PE and 7-AAD staining based flow cytometry analysis (Rvb = 1.89 %),annexin V-PE and 7-AAD staining based flow cytometry analysis,Annexin V apoptosis assay,BAO_0010265
2029444,F,Induction of autophagy in human DLD-1 cells assessed as vacuole formation at 7.5 uM incubated for 24 hrs in presence of Bafilomycin-A1 by phase contrast microscopic analysis,phase contrast microscopic analysis,phase contrast microscopy,BAO_0000458
1868563,F,Induction of morphological changes in human HeLa cells assessed as swollen cells at IC50 after 24 hrs by phase contrast microscopic analysis,phase contrast microscopic analysis,phase contrast microscopy,BAO_0000458
1853595,F,Induction of cell cycle arrest in human HCT116 cells assessed as debris content at 0.7 uM incubated for 24 hrs by PI staining based flow cytometric analysis (Rvb = 0%),PI staining based flow cytometric analysis,propidium iodide DNA staining,BAO_0002476
1853595,F,Induction of cell cycle arrest in human HCT116 cells assessed as debris content at 0.7 uM incubated for 24 hrs by PI staining based flow cytometric analysis (Rvb = 0%),PI staining based flow cytometric analysis,flow cytometry,BAO_0000005
2105132,F,Induction of cell cycle arrest in human MDA-MB-231 cells assessed as accumulation at S phase at 4 uM incubated for 24 hrs by PI staining based flow cytometry analysis (Rvb = 40.37 to 57.89 %),PI staining based flow cytometry analysis,propidium iodide DNA staining,BAO_0002476
2105132,F,Induction of cell cycle arrest in human MDA-MB-231 cells assessed as accumulation at S phase at 4 uM incubated for 24 hrs by PI staining based flow cytometry analysis (Rvb = 40.37 to 57.89 %),PI staining based flow cytometry analysis,flow cytometry,BAO_0000005
2023321,F,Antiproliferative activity against human HUT78 assessed as reduction in cell viability incubated for 3 days by Cell Titer Blue assay,Cell Titer Blue assay,CellTiter-Blue Cell Viability Assay (Promega),BAO_0140012
1846866,F,Antiproliferative activity against human HL7702 cells assessed as reduction in cell viability after 48 hrs by MTT assay,MTT assay,MTT reduction assay,BAO_0002457
1721442,F,Antiproliferative activity against human NCI-H2228 cells harboring EML4-ALK after 72 hrs by MTT assay,MTT assay,MTT reduction assay,BAO_0002457
2214047,F,Antiproliferative activity against human A498 cells assessed as cell growth inhibition measured after 72 hrs by SRB assay,SRB assay,sulforhodamine B staining,BAO_0002460
2108689,F,Antiproliferative activity against human HCT-116 cells assessed as inhibition of cell growth incubated for 72 hrs by MTT assay,MTT assay,MTT reduction assay,BAO_0002457
989337,F,Antiproliferative activity against human HCT8 cells by MTT assay,MTT assay,MTT reduction assay,BAO_0002457
641661,F,Growth inhibition of human HL-60(TB) cells after 48 hrs by sulforhodamine B assay,sulforhodamine B assay,sulforhodamine B staining,BAO_0002460
623020,F,Growth inhibition of human HCC2998 cells at 100 nM after 96 hrs by MTT assay,MTT assay,MTT reduction assay,BAO_0002457
1831311,F,"Induction of multi-nuclei formation in mouse LL/2 cells at 0.8 uM after 24 hrs in presence of paclitaxel by 4',6-diamidino-2-phenylindole staining-based assay","4',6-diamidino-2-phenylindole staining-based assay",colorimetric cell staining method,BAO_0002455
1789168,F,Induction of apoptosis in human MDA-MB-231 cells assessed as early apoptotic cells at 10 uM after 72 hrs by annexin-V/propidium iodide double staining based flow cytometry (Rvb = 0.02%),annexin-V/propidium iodide double staining based flow cytometry,propidium iodide DNA staining,BAO_0002476
1789168,F,Induction of apoptosis in human MDA-MB-231 cells assessed as early apoptotic cells at 10 uM after 72 hrs by annexin-V/propidium iodide double staining based flow cytometry (Rvb = 0.02%),annexin-V/propidium iodide double staining based flow cytometry,flow cytometry,BAO_0000005
1789168,F,Induction of apoptosis in human MDA-MB-231 cells assessed as early apoptotic cells at 10 uM after 72 hrs by annexin-V/propidium iodide double staining based flow cytometry (Rvb = 0.02%),annexin-V/propidium iodide double staining based flow cytometry,Annexin V apoptosis assay,BAO_0010265
1727619,F,Induction of apoptosis in human HCC827 cells assessed as increase in hypodiploid DNA content at 50 to 100 nM after 72 hrs by propidium iodide staining flow cytometry,propidium iodide staining flow cytometry,propidium iodide DNA staining,BAO_0002476
1727619,F,Induction of apoptosis in human HCC827 cells assessed as increase in hypodiploid DNA content at 50 to 100 nM after 72 hrs by propidium iodide staining flow cytometry,propidium iodide staining flow cytometry,flow cytometry,BAO_0000005
1717246,F,Induction of apoptosis in human MGC803 cells assessed as late apoptotic cells at 8 uM after 48 hrs Annexin V-FITC/propidium iodide based flow cytometry (1%),Annexin V-FITC/propidium iodide based flow cytometry,propidium iodide DNA staining,BAO_0002476
1717246,F,Induction of apoptosis in human MGC803 cells assessed as late apoptotic cells at 8 uM after 48 hrs Annexin V-FITC/propidium iodide based flow cytometry (1%),Annexin V-FITC/propidium iodide based flow cytometry,flow cytometry,BAO_0000005
1717246,F,Induction of apoptosis in human MGC803 cells assessed as late apoptotic cells at 8 uM after 48 hrs Annexin V-FITC/propidium iodide based flow cytometry (1%),Annexin V-FITC/propidium iodide based flow cytometry,Annexin V apoptosis assay,BAO_0010265
1656536,F,Growth inhibition of human LOXIMVI cells incubated for 48 hrs by sulforhodamine B assay,sulforhodamine B assay,sulforhodamine B staining,BAO_0002460
1647420,F,Growth inhibition of human KM12 cells assessed as cell growth at 0.003 uM incubated for 48 hrs by sulforhodamine B assay relative to control,sulforhodamine B assay,sulforhodamine B staining,BAO_0002460
1647301,F,Growth inhibition of human HCC2998 cells assessed as cell growth at 5 uM incubated for 48 hrs by sulforhodamine B assay relative to control,sulforhodamine B assay,sulforhodamine B staining,BAO_0002460
1580193,F,Potentiation of 2.5 nM (-)-lomaiviticin A-induced cytotoxicity against human K562 cells assessed as combination index at 10 uM after 48 hrs by cell titer-glo luminescence assay,cell titer-glo luminescence assay,CellTiter-Glo Luminescent Cell Viability Assay,BAO_0000682
1561734,F,Induction of apoptosis in human K562 cells assessed as up-regulation of Bax protein expression by Western blot analysis,Western blot analysis,western blot,BAO_0002424
1561733,F,Induction of apoptosis in human K562 cells assessed as downregulation of Bcl-2 protein expression by Western blot analysis,Western blot analysis,western blot,BAO_0002424
1516953,F,Induction of apoptosis in human MGC803 cells assessed as compact and condensed chromatin at 10 uM after 48 hrs using Hoechst 33258 staining by fluorescence microscopic analysis,Hoechst 33258 staining by fluorescence microscopic analysis,Hoechst,BAO_0000116
1516953,F,Induction of apoptosis in human MGC803 cells assessed as compact and condensed chromatin at 10 uM after 48 hrs using Hoechst 33258 staining by fluorescence microscopic analysis,Hoechst 33258 staining by fluorescence microscopic analysis,fluorescence microscopy,BAO_0000450
1472216,F,Induction of apoptosis in human HepG2 cells assessed as viable cells at 20 uM after 6 hrs by annexin V/propidium iodide staining-based flow cytometric analysis (Rvb = 90.9%),annexin V/propidium iodide staining-based flow cytometric analysis,propidium iodide DNA staining,BAO_0002476
1472216,F,Induction of apoptosis in human HepG2 cells assessed as viable cells at 20 uM after 6 hrs by annexin V/propidium iodide staining-based flow cytometric analysis (Rvb = 90.9%),annexin V/propidium iodide staining-based flow cytometric analysis,flow cytometry,BAO_0000005
1472216,F,Induction of apoptosis in human HepG2 cells assessed as viable cells at 20 uM after 6 hrs by annexin V/propidium iodide staining-based flow cytometric analysis (Rvb = 90.9%),annexin V/propidium iodide staining-based flow cytometric analysis,Annexin V apoptosis assay,BAO_0010265
1462240,F,Cell cycle arrest in human MCF7 cells assessed as accumulation at G0 phase at 2 uM after 48 hrs by FACS analysis (Rvb = 1.83 +/- 0.28%),FACS analysis,flow cytometry,BAO_0000005
1455786,F,Stimulation of growth in human MCF7 cells at 0.1 to 20 uM after 4 days by MTT assay,MTT assay,MTT reduction assay,BAO_0002457
1349583,F,Induction of apoptosis in p53 knock down human HCT116 cells assessed as PARP cleavage at 1 uM after 24 hrs by immunoblotting analysis,immunoblotting analysis,immunoassay,BAO_0000129
1339546,F,Induction of apoptosis in human A549 cells assessed as necrotic cells at 5 uM after 48 hrs by annexin V/PI staining-based FACS analysis (Rvb = 2.8 %),annexin V/PI staining-based FACS analysis,propidium iodide DNA staining,BAO_0002476
1339546,F,Induction of apoptosis in human A549 cells assessed as necrotic cells at 5 uM after 48 hrs by annexin V/PI staining-based FACS analysis (Rvb = 2.8 %),annexin V/PI staining-based FACS analysis,flow cytometry,BAO_0000005
1339546,F,Induction of apoptosis in human A549 cells assessed as necrotic cells at 5 uM after 48 hrs by annexin V/PI staining-based FACS analysis (Rvb = 2.8 %),annexin V/PI staining-based FACS analysis,Annexin V apoptosis assay,BAO_0010265
2145610,F,Induction of apoptosis in mouse GL261 cells assessed as early apoptotic cells at 50 uM measured after 24 hrs by annexin V-FITC/propidium iodide staining based flow cytometry analysis (Rvb = 1.61%),annexin V-FITC/propidium iodide staining based flow cytometry analysis,propidium iodide DNA staining,BAO_0002476
2145610,F,Induction of apoptosis in mouse GL261 cells assessed as early apoptotic cells at 50 uM measured after 24 hrs by annexin V-FITC/propidium iodide staining based flow cytometry analysis (Rvb = 1.61%),annexin V-FITC/propidium iodide staining based flow cytometry analysis,flow cytometry,BAO_0000005
2145610,F,Induction of apoptosis in mouse GL261 cells assessed as early apoptotic cells at 50 uM measured after 24 hrs by annexin V-FITC/propidium iodide staining based flow cytometry analysis (Rvb = 1.61%),annexin V-FITC/propidium iodide staining based flow cytometry analysis,Annexin V apoptosis assay,BAO_0010265
2088061,F,Induction of apoptosis in human A-375 cells assessed as necrotic cells at 2 uM incubated for 48 hrs by annexin V-FITC and PI staining based flow cytometry (Rvb = 0.139 %),annexin V-FITC and PI staining based flow cytometry,propidium iodide DNA staining,BAO_0002476
2088061,F,Induction of apoptosis in human A-375 cells assessed as necrotic cells at 2 uM incubated for 48 hrs by annexin V-FITC and PI staining based flow cytometry (Rvb = 0.139 %),annexin V-FITC and PI staining based flow cytometry,flow cytometry,BAO_0000005
2088061,F,Induction of apoptosis in human A-375 cells assessed as necrotic cells at 2 uM incubated for 48 hrs by annexin V-FITC and PI staining based flow cytometry (Rvb = 0.139 %),annexin V-FITC and PI staining based flow cytometry,Annexin V apoptosis assay,BAO_0010265
2067582,F,Induction of apoptosis in human HCC827 cells assessed as early apoptotic cells at 1 uM measured after 24 hrs by Annexin V-FITC/propidium iodide staining based flow cytometry (Rvb = 2.49%),Annexin V-FITC/propidium iodide staining based flow cytometry,propidium iodide DNA staining,BAO_0002476
2067582,F,Induction of apoptosis in human HCC827 cells assessed as early apoptotic cells at 1 uM measured after 24 hrs by Annexin V-FITC/propidium iodide staining based flow cytometry (Rvb = 2.49%),Annexin V-FITC/propidium iodide staining based flow cytometry,flow cytometry,BAO_0000005
2067582,F,Induction of apoptosis in human HCC827 cells assessed as early apoptotic cells at 1 uM measured after 24 hrs by Annexin V-FITC/propidium iodide staining based flow cytometry (Rvb = 2.49%),Annexin V-FITC/propidium iodide staining based flow cytometry,Annexin V apoptosis assay,BAO_0010265
1869875,F,Induction of apoptosis in human A549 cells assessed as early apoptotic cells at 2.5 uM after 12 hrs by Annexin V-FITC/propidium iodide staining-based flow cytometric analysis (Rvb = 7.19%),Annexin V-FITC/propidium iodide staining-based flow cytometric analysis,propidium iodide DNA staining,BAO_0002476
1869875,F,Induction of apoptosis in human A549 cells assessed as early apoptotic cells at 2.5 uM after 12 hrs by Annexin V-FITC/propidium iodide staining-based flow cytometric analysis (Rvb = 7.19%),Annexin V-FITC/propidium iodide staining-based flow cytometric analysis,flow cytometry,BAO_0000005
1869875,F,Induction of apoptosis in human A549 cells assessed as early apoptotic cells at 2.5 uM after 12 hrs by Annexin V-FITC/propidium iodide staining-based flow cytometric analysis (Rvb = 7.19%),Annexin V-FITC/propidium iodide staining-based flow cytometric analysis,Annexin V apoptosis assay,BAO_0010265
1844213,F,Induction of apoptosis in human HCT116 cells assessed as viable cells at 0.5 uM by Annexin-V FITC/propidium iodide staining-based flow cytometry (Rvb = 93.4 %),Annexin-V FITC/propidium iodide staining-based flow cytometry,propidium iodide DNA staining,BAO_0002476
1844213,F,Induction of apoptosis in human HCT116 cells assessed as viable cells at 0.5 uM by Annexin-V FITC/propidium iodide staining-based flow cytometry (Rvb = 93.4 %),Annexin-V FITC/propidium iodide staining-based flow cytometry,flow cytometry,BAO_0000005
1844213,F,Induction of apoptosis in human HCT116 cells assessed as viable cells at 0.5 uM by Annexin-V FITC/propidium iodide staining-based flow cytometry (Rvb = 93.4 %),Annexin-V FITC/propidium iodide staining-based flow cytometry,Annexin V apoptosis assay,BAO_0010265
1330988,F,Growth inhibition of human MDA-MB-231 cells assessed as cell growth at 10'-5 M after 48 hrs by sulforhodamine B assay,sulforhodamine B assay,sulforhodamine B staining,BAO_0002460
1284858,F,Growth inhibition of human OVCAR8 cells after 48 hrs by sulforhodamine B assay,sulforhodamine B assay,sulforhodamine B staining,BAO_0002460
987775,F,Growth inhibition of human NCI-ADR-RES cells assessed as cell growth at 10'-5 M after 48 hrs by sulforhodamine B assay relative to control,sulforhodamine B assay,sulforhodamine B staining,BAO_0002460
966269,F,Cell cycle arrest in human MGC803 cells assessed as reduction in G1 phase accumulation after 12 to 24 hrs by propidium iodide staining-based flow cytometry,propidium iodide staining-based flow cytometry,propidium iodide DNA staining,BAO_0002476
966269,F,Cell cycle arrest in human MGC803 cells assessed as reduction in G1 phase accumulation after 12 to 24 hrs by propidium iodide staining-based flow cytometry,propidium iodide staining-based flow cytometry,flow cytometry,BAO_0000005
964025,F,Cell cycle arrest in human Bel7402 cells assessed as accumulation at S phase at 0.15 uM after 48 hrs by propidium iodide staining-based FACS analysis (Rvb = 39.17 %),propidium iodide staining-based FACS analysis,propidium iodide DNA staining,BAO_0002476
