assay_id,assay_type,description,method,bao_preferred_term,bao_id
687324,B,Displacement of [3H]ZM241385 from human adenosine A2B receptor transfected in CHO cells after 60 mins by scintillation counting,scintillation counting,scintillation counting,BAO_0000405
3703,B,In vitro binding affinity by radioligand binding assay using cell line expressing human 5-hydroxytryptamine 7 receptor; ND means not determined,,,
2228192,B,Inhibition of human full length NSD2 at 10 uM by radioisotope-based filter binding assay,radioisotope-based filter binding assay,filter assay,BAO_0000401
751198,B,Inhibition of human recombinant NTS1 receptor at 10 uM by radioligand binding assay,,,
788137,B,Inhibition of human recombinant RON at 0.5 uM by radiometric filter-binding assay,radiometric filter-binding assay,filter assay,BAO_0000401
1568614,B,Agonist activity at rat mGlu2 receptor by FRET based mGlu sensor assay,FRET based mGlu sensor assay,fluorescence resonance energy transfer,BAO_0000001
1432679,B,Inhibition of integrin alphavbeta3 (unknown origin) by Merck binding assay,,,
1921767,B,"Inhibition of MAGL in human U937 cell homogenates incubated for 5 mins in presence of [1,2,3-3H]2-OG by liquid scintillation spectroscopy",liquid scintillation spectroscopy,scintillation counting,BAO_0000405
536900,B,Binding affinity to bone assessed as drug level bound to cattle bone meal powder by fluorescence assay,fluorescence assay,fluorescence method,BAO_0000046
602453,B,Binding affinity to human ALK at 200 nM by cell-based competition binding assay relative to control in presence of DTT,,,
1979354,B,Binding affinity to human partial length BRDT bromodomain 1 (N21 to E137 residues) expressed in bacterial expression system by BROMOscan assay,BROMOscan assay,,
1851040,B,Binding affinity to human partial length TRIM33 (D882 to A1087 residues) expressed in bacterial expression system at 1 uM by BROMOscan assay,BROMOscan assay,,
2209071,B,Binding affinity to human recombinant ERbeta by competitive fluorometric binding assay,competitive fluorometric binding assay,fluorescence method,BAO_0000046
2262115,B,Binding affinity to human Sirt3 (118 to 399 residues) assessed as dissociation constant (Koff) of ternary complex using acetylated MnSOD peptide as substrate in presence of OAADPr by short DNA nano levers based switchSENSE microfluid bio-chip analysis,short DNA nano levers based switchSENSE microfluid bio-chip analysis,,
1329746,B,Binding affinity to M4 receptor (unknown origin) by PDSP assay,,,
989636,B,Binding affinity to N-terminal domain of human Hsp90alpha by FAXS competitive binding assay,FAXS competitive binding assay,,
2231580,B,Binding affinity to PRDX6 in human MDA-MB-453 cells at 10 uM measured after 6 hrs in presence of 100 uM PES by pull-down assay,pull-down assay,affinity selection,BAO_0002501
215016,B,Binding affinity towards rat kidney Vasopressin V2 receptor by using functional assay,,,
1329505,B,"Competitive binding affinity to GLO-1 in HEK293T cell lysate at 50 uM after overnight incubation followed by UV-irradiation for 1 hr by pull-down assay in presence of N-(4-(4-(5-fluoro-4-(2-(methylsulfonamido)phenylamino)pyrimidin-2-ylamino)benzoyl)phenyl)-5-((3aS,4S,6aR)-2-oxohexahydro-1H-thieno[3,4-d]imidazol-4-yl)pentanamide",pull-down assay,affinity selection,BAO_0002501
2235893,B,Covalent binding affinity to N-terminal His-Smt-tagged MSK1 C-terminal kinase domain (414 to 738 residues) (unknown origin) expressed in Escherichia coli BL21 (DE3) at 1:1 ratio of enzyme to compound measured after 3 hrs by LC-MS analysis relative to control,LC-MS analysis,mass spectrometry,BAO_0000055
1751447,B,Displacement of TNP-ATP from recombinant Salmonella typhimurium GST-tagged DHp-catalytic domain PhoQ (332 to 487 residues) expressed in Escherichia coli XA90 aafter 10 mins by fluorescence assay,fluorescence assay,fluorescence method,BAO_0000046
2059816,B,"Inhibition of 5-(3-((1r,4r)-4-((5S,8S,11S,14S,17S,20S,29S)-11-((1H-imidazol-4-yl)methyl)-1,33-diamino-5-carbamoyl-17-(4-(4-(4-((4-(dimethylamino)phenyl)diazenyl)phenyl)butanamido)butyl)-8,14-bis(3-guanidinopropyl)-20-methyl-7,10,13,16,19,22,25,28-octaoxo-6,9,12,15,18,21,24,27-octaazatritriacontan-29-ylcarbamoyl)cyclohexyl)thioureido)-2-(6-hydroxy-3-oxo-3H-xanthen-9-yl)benzoic acid binding to SIRT2 (unknown origin) measured after 2 hrs in presence of NAD+ by fluorometric method",fluorometric method,fluorescence method,BAO_0000046
1899144,B,Inhibition of CMFDA binding to human N-terminal 6x-His-tagged GSTO1-1 at 10 uM preincubated for 30 mins followed by CMFDA addition and measured after 30 mins in presence of 10 uM MnCl2 by in-gel fluorescence binding assay,in-gel fluorescence binding assay,fluorescence method,BAO_0000046
2017246,B,Inhibition of FITC-labeled palmitate tracer binding to N-terminal His6-tagged human TEAD4 (217 to 434 residues) expressed in Escherichia coli BL21-CodonPlus (DE3)-RIPL cells assessed as ratio of Kinact to Ki measured after 1 to 24 hrs by fluorescence assay,fluorescence assay,fluorescence method,BAO_0000046
815855,B,Inhibition of GPIbalpha-vWF binding assessed as inhibition of ristocetin-induced platelet agglutination at 100 uM after 2 mins by static agglutination assay,static agglutination assay,,
653926,B,Binding affinity to (CAG-CAG) trinucleotide repeats at 120 uM by ESI-TOF mass spectroscopy,ESI-TOF mass spectroscopy,mass spectrometry,BAO_0000055
695627,B,Binding affinity to CGT ACA GTG DNA sequence assessed as change in melting temperature by thermal denaturation assay,thermal denaturation assay,nucleic acid conformation assessment,BAO_0000469
1770851,B,Binding affinity to Staphylococcus aureus genomic DNA at pH 7.4 at 294 K by fluorescence quenching analysis,fluorescence quenching analysis,fluorescence method,BAO_0000046
516355,B,Displacement of [3H]estradiol from human recombinant estrogen receptor alpha by radiometric assay relative to estradiol,,,
1650979,B,Displacement of [3H]NVP-QAW039 from human DP2 receptor expressed in CHO cell membranes assessed as association rate constant by TopCount scintillation assay,TopCount scintillation assay,scintillation counting,BAO_0000405
474423,B,Displacement of [3H]R5020 from human PR in human T47D cells by whole cell assay,,,
1460139,B,Displacement of [3H]spiperone from human D4.4 receptor stably expressed in CHO cell membranes by competitive binding assay,,,
560038,B,Agonist activity at human CB1 receptor expressed in SF9 cells assessed as inhibition of CP-55940-stimulated GTP binding,,,
2208413,B,Antagonist activity at AMPA receptor (unknown origin),,,
1698440,B,Antagonist activity at muscarinic M1 receptor (unknown origin),,,
67359,B,Functional ERalpha receptor activity in transcriptional activation assay in MCF-7 cells,transcriptional activation assay,targeted transcriptional assay,BAO_0010044
1275686,B,Inhibition of LYN (unknown origin) after 90 mins by TR-FRET/IMAP fluorescence polarization assay,TR-FRET/IMAP fluorescence polarization assay,IMAP Assay of phosphoproteins (Molecular Devices),BAO_0140036
1746638,B,Inhibition of recombinant human full length N-terminal His6-tagged and N-terminal GST-tagged CDK5/p35 expressed in baculovirus Sf21 insect cells at 10 uM by filter binding radioactive ATP transferase assay relative to control,filter binding radioactive ATP transferase assay,transferase activity assay,BAO_0002795
1746638,B,Inhibition of recombinant human full length N-terminal His6-tagged and N-terminal GST-tagged CDK5/p35 expressed in baculovirus Sf21 insect cells at 10 uM by filter binding radioactive ATP transferase assay relative to control,filter binding radioactive ATP transferase assay,filter assay,BAO_0000401
1746680,B,Inhibition of recombinant human N-terminal/C-terminal His6-tagged PAK2 (3 to end residues) expressed in Escherichia coli at 10 uM by filter binding radioactive ATP transferase assay relative to control,filter binding radioactive ATP transferase assay,transferase activity assay,BAO_0002795
1746680,B,Inhibition of recombinant human N-terminal/C-terminal His6-tagged PAK2 (3 to end residues) expressed in Escherichia coli at 10 uM by filter binding radioactive ATP transferase assay relative to control,filter binding radioactive ATP transferase assay,filter assay,BAO_0000401
60971,B,pKi value for Dopamine receptor D2 binding site,,,
2164646,B,"Reactivation of NIMP-inhibited recombinant His-TEV-tagged human AChE expressed in CHO-K1 cells assessed as reactivation constant, Kr by measuring thiophenol levels by UV-vis absorption spectroscopy",UV-vis absorption spectroscopy,absorbance,BAO_0000070
1636438,B,"Potency index, ratio of galantamine IC50 to compound IC50 for horse serum BuChE",,,
229363,B,Ratio of cytochrome P450 19A1 Ki for 6-alpha substituted steroid relative to 6-beta substitution,,,
656702,B,Ratio of IC50 for inhibition of HIV1 HXB2 gp120-mediated viral infusion into HEK293 cells in presence of 45 mg/ml human serum albumin to IC50 for inhibition of HIV1 HXB2 gp120-mediated viral infusion into HEK293 cells in absence of 45 mg/ml human serum albumin,,,
490012,B,Ratio of Kcat to Km for HIV1 reverse transcriptase assessed as nucleotide excision activity in presence of 0.5 uM dCTP,,,
1674696,B,Ratio of Kinact to Ki for S-adenosyl-L-homocysteine hydrolase (unknown origin),,,
86691,B,Ratio of Kreact to that of Kinact was determined on human leukocyte elastase(HLE),,,
941525,B,Ratio of TXA IC50 to compound IC50 for human Glu-plasminogen/fibrinogen interaction by clot-lysis buffer assay,clot-lysis buffer assay,,
55304,B,Selective index for Dihydrofolate reductase was determined by IC50(rat liver) / IC50(Toxoplasma gondii),,,
229570,B,Selectivity as ratio of pA2 value against alpha-2 receptor to that of alpha-1 receptor.,,,
146271,B,Selectivity ratio is IC50 value of mu-opioid receptor to that of delta-opioid receptor,,,
1895739,B,Selectivity ratio of ki for muscarinic M4 receptor (unknown origin) expressed in CHO cells to muscarinic M2 receptor (unknown origin) expressed in CHO cells,,,
37378,B,Evaluated for its agonist activity and the binding affinity against human Beta-1 adrenergic receptor in membranes from chinese hamster ovary cell,,,
157538,B,Binding affinity against HIV-Protease was determined,,,
303054,B,Binding affinity against Synechocystis strain PCC6803 DXP reductoisomerase,,,
305518,B,Binding affinity for Prostaglandin G/H synthase 2 (COX-2),,,
63532,B,Binding affinity measured in CHO cells stably transfected with the human endothelin B receptor,,,
963022,B,Binding affinity to 5HT2A receptor (unknown origin),,,
1279931,B,Binding affinity to AT1 receptor (unknown origin),,,
476688,B,Binding affinity to CB2 receptor,,,
2197346,B,Binding affinity to D4 receptor (unknown origin) assessed as dissociation constant,,,
2051018,B,Binding affinity to DAT (unknown origin) assessed as inhibition of ligand binding at 10 uM relative to control,,,
440187,B,Binding affinity to GAPDH in human erythrocytes,,,
1921222,B,Binding affinity to HIV1 cYTA48P envelope glycoprotein gp120 infected in human TZM-b1 cells assessed as induction of conformational changes by measuring combination index at 450:1 ratio of test compound to KD-247 measured after 48 hrs,,,
1576400,B,Binding affinity to HIV1 protease N88D mutant,,,
447281,B,Binding affinity to human ERalpha,,,
448621,B,Binding affinity to human ERbeta,,,
445591,B,Binding affinity to human ERbeta,,,
537086,B,Binding affinity to human KHS1,,,
2197502,B,Binding affinity to human recombinant 5-HT2A assessed as inhibition constant,,,
818809,B,Binding affinity to human recombinant 5HT2C receptor,,,
658554,B,Binding affinity to human recombinant GABAA receptor,,,
2130535,B,Binding affinity to human SIRT1 human MDA-MB-231 cells assessed as increase in thermal stability heated for 3 mins up to 1 degC at 10 uM by cellular thermal shift assay,cellular thermal shift assay,thermal shift assay,BAO_0010261
944109,B,Binding affinity to JAK1 (unknown origin) at 10 uM relative to control,,,
1829544,B,Binding affinity to LSD1 (unknown origin),,,
877015,B,Binding affinity to mGlu1 receptor in rat brain pons at 7.4 MBq after 60 mins by autoradiography,autoradiography,autoradiography,BAO_0002527
877019,B,Binding affinity to mGlu1 receptor in rat thalamus at 7.4 MBq after 60 mins by autoradiography,autoradiography,autoradiography,BAO_0002527
532315,B,Binding affinity to Plasmodium falciparum spermidine synthase by saturation transfer difference-NMR experiment,saturation transfer difference-NMR experiment,nuclear magnetic resonance,BAO_0000160
627749,B,Binding affinity to PPARgamma,,,
981821,B,Binding affinity to PPARgamma (unknown origin) at 10 uM by Polarscreen competitor assay relative to rosiglitazone,Polarscreen competitor assay,PolarScreen Competitor Assay Kit,BAO_0003076
2260017,B,Binding affinity to TCP-stimulated NMDA (unknown origin),,,
33373,B,Binding affinity towards Alpha-2B adrenergic receptor; ND=No data,,,
33326,B,Binding affinity towards human alpha-2 adrenergic receptor,,,
154359,B,Binding affinity towards peroxisome proliferator activated receptor gamma (PPAR gamma); weakly active,,,
774448,B,Binding constant for DRAK1 kinase domain,,,
774208,B,Binding constant for NIM1 kinase domain,,,
302265,B,Binding potency towards Delta opioid receptor of mouse vas deferens,,,
140186,B,Compound was evaluated for its binding affinity towards M2 receptor in rat brainstem,,,
223059,B,Compound was evaluated for the binding constant for association with nicotinic acetylcholine receptor (nAChR),,,
562670,B,Displacement of 4-methylumbelliferydiacetyl-chitobiose from Serratia marcescens ChiB,,,
36274,B,Displacement of DHT from human androgen receptor,,,
195972,B,In vitro binding affinity for human renin at pH 7.2,,,
514923,B,Inhibition of luciferin binding site of Photuris pennsylvanica luciferase by competitive KinaseGlo Plus Max luminescent assay,competitive KinaseGlo Plus Max luminescent assay,Kinase-Glo Plus Luminescent Kinase Assay,BAO_0000678
66845,B,Relative binding affinity (RBA) for estrogen receptor at 0C,,,
31220,B,Saturation binding of human Adenosine A2A receptor (H250N) at pH 6.8,,,
1460861,B,"Ratio of Kd for GST-tagged phosphorylated p38-alpha (unknown origin) to IC50 for uman recombinant 5'-c-myc, His6-tagged p38-alpha using MK2 (46-400) as substrate",,,
52456,B,"Ability to interact with DNA was assessed by a DNA/ethidium bromide dye displacement assay, expressed as DC50 for polydAdT",ethidium bromide dye displacement assay,ethidium bromide DNA staining,BAO_0002474
2052717,B,Binding affinity at Escherichia coli pBR322 DNA assessed as unwinding of supercoiled DNA at 10 uM incubated for 10 mins in presence of human topoisomerase 1 by agarose gel based electrophoresis,agarose gel based electrophoresis,agarose gel,BAO_0010020
494280,B,Binding affinity to calf thymus DNA assessed as circular dichrosim at 10 uM,circular dichrosim,circular dichroism,BAO_0000161
815840,B,Binding affinity to calf thymus DNA assessed as melting temperature,,,
2260695,B,Binding affinity to calf thymus DNA assessed as stabilization by measuring melting temperature at ratio of 0.2 by UV/vis spectrophotometric (Rvb = 66 degreeC),UV/vis spectrophotometric,absorbance,BAO_0000070
434771,B,Binding affinity to calf thymus double stranded DNA,,,
1929767,B,Binding affinity to calf thymus duplex DNA assessed as induction of hyperchromic shift at 257 nanometer at 50 uM in pH 7 phosphate buffer by UV-vis spectrophotometric analysis,UV-vis spectrophotometric analysis,absorbance,BAO_0000070
2105425,B,Binding affinity to DNA Hoxa9-binding site-5'-ATTTA/5'ATGA double mutant (strand a-CTGCGTAGCGTCACGACCGC/strand b-GCGGTCGTGACGCTACGCAG) (unknown origin) by UV/visible spectrophotometric method,UV/visible spectrophotometric method,absorbance,BAO_0000070
588548,B,Binding affinity to Escherichia coli pUC19 DNA assessed as form 1 DNA level at 0.130 mM after 8.08 hrs by agarose gel electrophoresis,agarose gel electrophoresis,agarose gel,BAO_0010020
1925887,B,Binding affinity to pre-annealed c-MYC G-quadruplex (unknown origin) in 10 mM Tris.HCl buffer containing 100 mM KCl at pH 7.4 by UV/Visible spectroscopy,UV/Visible spectroscopy,absorbance,BAO_0000070
52280,B,Binding constant for DNA by ethidium bromide displacement,ethidium bromide displacement,ethidium bromide DNA staining,BAO_0002474
52441,B,Compound was evaluated for DNA-binding affinity using poly[d(GC)]2,,,
49482,B,The ability to reversibly bind to DNA using ethidium bromide displacement assay was reported as apparanet DNA binding constant for Coliphage T4 DNA,ethidium bromide displacement assay,ethidium bromide DNA staining,BAO_0002474
2131421,B,Inhibition of C-terminal 6-His-tagged beta-catenin (1 to 781 residues) (unknown origin) expressed in Escherichia coli BL21 (DE3)-N-terminal biotinylated human BCL9 (350 to 375 residues) protein-protein interaction incubated for 1 hr by Alphascreen assay,Alphascreen assay,alphascreen,BAO_0000130
146904,B,Binding affinity against Opioid receptor delta 1 of rat brain using [3H]-nor BNI as radioligand.,,,
60370,B,Binding affinity determined by measuring its ability to displace [3H]N-0437 radioligand in CHO-K1 cells on Cloned Human Dopamine receptor D2,,,
139241,B,Binding affinity towards cloned human muscarinic acetylcholine receptor M4 stably expressed in CHO-K1 cells using [3H]N-methylscopolamine,,,
304048,B,Binding affinity towards human 5-hydroxytryptamine receptor 6 expressed in HeLa cells using the radioligand [3H]LSD,,,
303088,B,Binding affinity towards human D2 short receptor using [3H]spiperone expressed in CHO cells,,,
154707,B,Binding affinity was measured as selectivity for sigma-1 site over phencyclidine (PCP) receptor in rat using [3H]TCP as radioligand at 10 uM,,,
148551,B,"Compound was evaluated for Inhibition of binding of [3H]- DAMGO at Rat brain mu receptor binding site, Expt-2",,,
3306,B,Compound was evaluated for the binding affinity against human cloned 5-hydroxytryptamine 4 receptor in HeLa cells using [3H]-LSD as the radioligand,,,
149007,B,Compound was tested for binding affinity towards Opioid receptor mu 1 by displacing [3H]DAGO radioligand in rat brain P2 synaptosomes membranes.,,,
30534,B,Concentration required for 50% inhibition of [3H]NECA binding on rat brain adenosine A2 receptor,,,
143180,B,Concentration required to inhibit opiate receptor using radioligand [3H]- Etorphine,,,
143997,B,Concentration that inhibited 50% of binding of 125 I -PYY ligand to human Neuropeptide Y receptor type 5,,,
31060,B,"Displacement [3H]-CGS-21,680 from Adenosine A2A receptor in rat striatal membrane.",,,
1842749,B,Displacement of (+)-[3H]pentazocine from sigma1 receptor in guinea pig brain membranes,,,
47961,B,Displacement of [125I]- BH-CCK-8 from Cholecystokinin type B receptor of guinea pig cortex,,,
686801,B,Displacement of [125I]-C5a Anaphylatoxin from anaphylatoxin C5a at 1 to 3 uM,,,
327286,B,"Displacement of [125I]-His5, D-Tyr6]GnRH from mutant GnRHR, GnRHR S186D",,,
1559495,B,Displacement of [125I]Endothelin-1 from human recombinant Endothelin-B receptor expressed in CHO cells at 10'-5 M,,,
1285619,B,Displacement of [125I]Sarile from human AT2 receptor expressed in HEK293 cells,,,
161303,B,Displacement of [3H]- PDBu from Protein kinase C gamma C1b domain,,,
855538,B,Displacement of [3H]-5-CT from human 5-HT7b receptor expressed in HEK293 cells after 1 hr,,,
2027,B,Displacement of [3H]-5-HT from human 5-hydroxytryptamine 1D receptor beta,,,
1545083,B,Displacement of [3H]-ketanserin from human 5-HT2A receptor expressed in HEK293 cells incubated for 1 hr,,,
2079764,B,Displacement of [3H]-LSD from human 5HT6 receptor expressed in HEK293 cell membrane at 10^-6 M measured after 60 mins relative to control,,,
793560,B,Displacement of [3H]-PGE2 from mouse EP4 receptor expressed in CHO cells after 60 mins by liquid scintillation counter,liquid scintillation counter,scintillation counting,BAO_0000405
31960,B,Displacement of [3H]-SCH- 58261 from human adenosine A2A receptor expressed in CHO cells; range 65-92,,,
965434,B,Displacement of [3H]8-OH-DPAT from human recombinant 5HT1A receptor expressed in CHOK1 cells after 60 mins,,,
602018,B,Displacement of [3H]AMPA from wild type rat GluR2 S1S2 ligand binding core,,,
746775,B,Displacement of [3H]AVP from human V2 receptor expressed in CHO cells,,,
852592,B,Displacement of [3H]CCPA from adenosine A1 receptor in rat brain cortical membrane,,,
860849,B,Displacement of [3H]epibatidine from rat alpha2beta4 nACHR at 10 uM,,,
466333,B,Displacement of [3H]estradiol from human recombinant ERbeta relative to estradiol,,,
68591,B,Displacement of [3H]GABA from rat brain Gamma-aminobutyric acid receptor,,,
795795,B,Displacement of [3H]histamine from rat H1R,,,
435199,B,Displacement of [3H]MK-801 from rat brain NMDA receptor,,,
509571,B,Displacement of [3H]MRS1754 from human adenosine A2B receptor expressed in CHO cell membrane,,,
990753,B,Displacement of [3H]N-alpha-methylhistamine from rhesus monkey histamine H3 receptor expressed in CHO cells,,,
538318,B,Displacement of [3H]NECA from human cloned adenosine A3 receptor expressed in human HeLa cells,,,
525851,B,Displacement of [3H]NMS from human cloned muscarinic M5 receptor expressed in insect Sf9 cells,,,
449795,B,Displacement of [3H]oxytocin from human oxytocin receptor expressed in CHO cells at 1000 nM,,,
160631,B,Displacement of [3H]PDBu from protein kinase C beta C1b domain,,,
157813,B,Displacement of [3H]PGE-2 from human Prostaglandin E receptor EP3 expressed in CHO-KI cells,,,
1514952,B,Displacement of [3H]raclopride from dopamine D2 receptor in Sprague-Dawley rat striatal membranes after 30 mins,,,
493450,B,Displacement of [3H]Ro-154513 from benzodiazepine binding site of GABAA alpha-4-beta-2-gamma-2 receptor expressed in HEK293T cells,,,
748964,B,Displacement of [3H]SCH233930 from human D1 receptor expressed in HEK cells,,,
588130,B,Displacement of [3H]spiperone from human cloned dopamine D3 expressed in CHO cells,,,
1703545,B,Displacement of [3H]spiperone from human D2-short receptor expressed in CHO cell membranes,,,
665576,B,Displacement of [3H]Spiperone from human dopamine D2 short receptor expressed in CHO cells,,,
431066,B,Displacement of [3H]SR141716A from human CB1 receptor expressed in CHO cells at 10 uM,,,
597913,B,Displacement of [3H]SR141716A from rat brain CB1 receptor,,,
938376,B,"Displacement of [3H]WIN-55,212-2 from human recombinant CB2 receptor expressed in CHO-K1 cells at 10 uM relative to control",,,
535635,B,Displacement of 2-[125I]iodomelatonin from human MT1 receptor expressed in HEK293 cells,,,
428740,B,Displacement of 3H]RX821002 from rat cortex adrenergic alpha-2 receptor,,,
512423,B,Displacement of radioligand from adrenergic alpha2A receptor,,,
2161850,B,Displacement of sphingosine D-erythro [3-3H] I- phosphate from human S1P2 receptor expressed in CHO cell membrane,,,
320918,B,In vitro binding affinity towards cloned human 5-HT6 receptor using [3H]5-carboximidotryptamine as radioligand: nd=Not determined,,,
60815,B,In vitro for its ability to displace [3H]- spiperone from cloned human Dopamine receptor D4 expressed in CHO cells,,,
306826,B,In vitro inhibitory concentration against binding of the [3H]glycine to strychnine-insensitive glycine binding sites of rat N-methyl-D-aspartate glutamate receptor,,,
2430,B,Inhibition constant for in vitro inhibition of [3H]ketanserin binding to rat frontal cortex membranes 5-hydroxytryptamine 2A receptor,,,
868,B,"Inhibition of [3H]8-hydroxy-2-dipropylamino-1,2,3,4-tetrahydronaphthalene binding to 5-hydroxytryptamine 1A receptor in hippocampus region of rat brain; Residual radioligand binding higher than 50%",,,
320862,B,Inhibition of [3H]CGS-21680 binding to adenosine A2a receptor of human striatal membrane,,,
196770,B,Inhibition of 3[H]9-cis-retinoic acid binding to Retinoic acid receptor RXR-alpha expressed in CV-1 cells,,,
145392,B,Inhibition of binding of [3H]diprenorphine to cloned human Opioid receptor kappa 1 expressed in CHO cell membrane,,,
149058,B,Inhibition of binding of [3H]oxytocin to rat uterine oxytocin receptor,,,
1457920,B,Inhibition of human 5HT3 at 10 uM by [3H]RL43694 binding assay relative to control,,,
592537,B,Inhibition of radioligand binding to human adrenergic Alpha-2C receptor at 10 uM after 60 mins,,,
876212,B,Inhibition of radioligand binding to human adrenergic alpha2c receptor at 10 uM,,,
28218,B,Percent remaining of radioligand [3H]DPCPX binding to human adenosine A1 receptor at 10 uM,,,
325472,B,Percentage inhibition of [3H]NECA binding to cloned human adenosine A2A receptor expressed in CHO cells at 10 uM,,,
1845612,B,"Potency index, ratio of [Nle15]MG11 IC50 to test compound IC50 for displacement of [177Lu] PP-F11N from CCK2R (unknown origin) transfected in A431 cells incubated for 1 hr at 4 degree C followed by compound washout with PBS buffer using Lu3+ labeled compound by Cobra-2 gamma counter method",Cobra-2 gamma counter method,scintillation counting,BAO_0000405
1991288,B,Ratio of Ki for displacement of [3H]DPCPX from Sprague-Dawley rat whole brain membrane A1AR in presence of GTP to Ki for displacement of [3H]DPCPX from Sprague-Dawley rat whole brain A1AR,,,
143173,B,"Tested for displacement of radioligand [3H]naloxone from opiate receptor; ND, no data",,,
140142,B,The compound was tested for binding affinity against muscarinic acetylcholine receptor using QNB as radioligand,,,
210907,B,The compound was tested for relative binding affinity against calf uterine receptor using [3H]estradiol as radioligand,,,
146556,B,The compound was tested for the ability to displace mu-receptor specific radioligand [3H]DAGO,,,
