assay_id,assay_type,description,method,bao_preferred_term,bao_id
311581,F,Cytotoxicity against A549 cell line,,,
88744,F,Cytotoxic activity against human neuroblastoma IMR32 cells which over-express somatostatin receptors; na is not active,,,
75628,F,Cytotoxicity against a human colon cancer cell line (HCT116 cells) was reported,,,
926445,F,Decrease in Botryosphaeria dothidea ligninolytic enzyme production assessed as laccase activity using ABTS as substrate at 25 mM measured at 28 degC after 4 days,,,
148037,F,"Antitumor activity against P338 leukemia cells measured as toxic level at 3.12 mg/kg, ip optimal dose on days 1-5 in mice",,,
167325,F,Opioid agonist activity by measuring the analgesia produced after 10 mg/kg administration in rats; none,,,
1765481,F,In-vivo binding affinity to transthyretin in beagle dog serum assessed as protein occupancy 5 mg/kg/day dosed daily dosed as single administration via oral gavage,,,
877041,F,"Inhibition of mTORC1 in human PC3 cells xenografted mouse assessed as reduction of phosphorylated p70S6K level at 25 to 100 mg/kg, po after 6 hrs",,,
795958,F,"Inhibition of human recombinant MMP12-induced lung inflammation in C57BL/6 mouse assessed as reduction in bronchoalveolar lavage inflammation at 5 mg/kg, po bid at 2 hrs prior to and 12 hrs post challenge measured 24 hrs after last challenge relative to vehicle treated control",,,
473897,F,"Antimycobacterial activity against Mycobacterium tuberculosis ATCC 35801 infected in CD1 mouse assessed as bacterial load in spleen at 25 mg/kg, ip after 10 days",,,
576733,F,"Antifungal activity against 1.04 x 10'8 CFU Candida glabrata isolate 4293 infected in CD1 mouse assessed as inhibition of regrowth in fungal burden in kidney at 1 mg/kg/day, ip administered from day 1 to day 2 post viral challenge measured on day 7 postinfection",,,
1773499,F,Antifungal activity against Candida albicans ATCC 90028 infected in Galleria mellonella larvae infected with 20 uM compound pre-treated cell suspensions assessed as melanization incubated in dark for 144 hrs at 30 degC and measured every 24 hrs (Rvb = 65%),,,
939587,F,"Antimalarial activity against chloroquine, mefloquine and halofantrine-resistant Plasmodium yoelii nigeriensis infected in Swiss mouse assessed as protection against parasite-induced mortality at 24 mg/kg, po administered for 4 days measured on day 28",,,
708208,F,"Trypanocidal activity against Trypanosoma brucei brucei 667 infected in mouse assessed as average day of relapse of trypanosomal infection at 25 mg/kg, ip BID for 14 days",,,
122514,F,Inhibition of Rauscher leukemia virus in female BALB/c mice. Compound is administered perorally at 125 mg/kg for 5 days a week for 4 weeks (exp 1); treated/control= 46.8/46.0,,,
1645352,F,Analgesic activity in CFA-induced mechanical hyperalgesia C57BL/6J mouse model assessed as mechanical paw withdrawal threshold at 3 ug/10 uL administered intrathecally 2 days after CFA injection measured at 90 to 150 mins post dose,,,
2115206,F,"Gastroprokinetic activity in CD-1 mouse assessed as stimulation of gastrointestinal motility by measuring fecal number at 10 mg/kg, po measured after 2 hrs (Rvb = 5.3 +/-0.7 No_unit)",measuring fecal number,visual observation method,BAO_0050002
1931928,F,"Antiinflammatory activity in Sprague-Dawley rat assessed as inhibition of croton oil-induced ear edema at 15 mg/kg, ip administered 1 hr before croton oil challenge measured after 3 hrs post challenge relative to control",,,
1543802,F,"Anticonvulsant activity in CF1 albino mouse assessed as protection against 6 Hz-psychomotor-induced seizure at 50 mg/kg, ip after 4 hrs",,,
834505,F,"Anticonvulsant activity in mouse assessed as protection against subcutaneous pentylenetetrazole-induced seizures at 300 mg/kg, ip after 4 hrs",,,
833701,F,"Antitumor activity against human A549 cells xenografted in nu/nu mouse assessed as inhibition of tumor volume at 3 mg/kg, ip administered three times a week for 3 weeks",,,
37727,F,Median survival time (% T/C) after ip administration of a dose of 4 mg/kg/day in B-16 melanoma in mice,,,
107760,F,Evaluated for survival time of P388 Leukemia implanted female CDF1 Mice at a dose of 25 mg/kg,,,
1338888,F,"Antitumor activity against mouse S180 cells allografted in ddY mouse assessed as tumor growth inhibition at 10 mg/kg, po administered once every 2 days for 2 weeks relative to control",,,
1513272,F,"Antitumor activity against human NCI-H3122 cells xenografted in SCID mouse assessed as tumor growth inhibition at 50 mg/kg, po qd for 14 days",,,
117836,F,Nephrotoxicity upon intragastric administration was assessed in mice kidney as proximal tublar necrosis deep in the cortex at a dose of 10 mM,,,
2160336,F,"Antitumour activity against human LNCaP cells xenografted in CB17 SCID mouse assessed as tumour growth inhibition at 2.5 mg/kg, IT(Intratumoral) administered once in every week for 25 days",,,
1651596,F,"Antitumor activity against mouse H22 cells implanted in Kunming mouse assessed as tumor growth inhibition at 24 mg/kg, ip administered once in every 3 days totally for 3 times relative to control",,,
2170430,F,"Antitumor activity against human Raji cells xenografted in NOD-SCID mouse assessed as tumor growth inhibition at 1.5 mg/kg, po administered for 25 days",,,
185374,F,Effect on urinary excretion potassium and sodium after oral administration of 25 mg/kg to rats(potassium and sodium excretion in control rat is 0.146+/-0.017),,,
125044,F,Uterotrophic activity in immature mouse,,,
1356171,F,Hypolipidemic activity in Wistar rat assessed as reduction in plasma cholesterol level at 499 umol/kg/day administered through diet for 4 days,,,
912047,F,"Hypolipidemic activity in high cholesterol diet fed Mus musculus KM (mouse) assessed as low density lipoprotein cholesterol at 150 mg/kg, ig for 10 days (Rvb = 4.2972 +/- 1.1725 mmol/l)",,,
427950,F,Effect on ratio of total cholesterol to HDL cholesterol in lean Wistar rat at 70 mg/kg/day relative to control,,,
328483,F,Increase of HDL level in cholesterol-fed male rats by ultracentrifugation method at 55 mg/kg/day relative to control,ultracentrifugation method,,
902639,F,"Antihyperlipidemic activity in high fat-high cholesterol fed New Zealand Oryctolagus cuniculus (rabbit) assessed as total cholesterol level in blood at 10 mg/kg, po for 40 days (Rvb = 8.74 +/- 0.53 mmol/l)",,,
820687,F,"Antidyslipidemic activity in fasted beagle dog assessed as reduction in free fatty acid level in plasma at 2 mg/kg, po after 1 hr relative to vehicle-treated control",,,
857710,F,Antiobesity activity in po dosed wild type DIO C57 mouse assessed as reduction of food intake,,,
222348,F,5-HTP accumulation in limbic system was determined in vivo,,,
185993,F,Maximal reduction in percent (Partial response) of DOPA accumulation rat hemispheres at highest test dose of 61 uM/Kg (po); Inactive,,,
186424,F,"Dose-dependent protective activity at 10 mg/kg (po, b.i.d.) on cartilage damage in hind paws of CIA-rats",,,
166452,F,Concentration required to decrease 25% of blood pressure in rat; ED25 not reached at 1.0 mg/kg iv,,,
44934,F,Effective dose required to produce an increase in dP/dt by 1500 mmHg/s from that of the control in the anesthetized cats.,,,
507889,F,"Inhibition of cartilage damage in New Zealand white rabbit osteoarthritis model assessed as reduction of cartilage lesion on femoral condyles at 30 mg/kg, po twice daily after 5 weeks relative to control",,,
151167,F,MST of treated animal over control when administered at a dose of 5 mg/kg intravenously on Q01Dx01 treatment schedule,,,
912430,F,"Antidiabetic activity against STZ-induced diabetic Rattus norvegicus Wistar albino (rat) assessed as change in hemoglobin at 20 mg/kg, po administered via intragastric tube for 45 days (Rvb = 8.5 +/-0.9 mg/dl)",,,
47207,F,Effect of intravenous infusion on diastolic pressure in Anesthetized cats at a dose of 1.50 mg/kg at 10 min,,,
167428,F,"Effect of pretreatment with alpha-MPT on the rotational behavior induced by the compound (5 mg/kg, sc) in rats with 6-OHDA induced lesions (indicates that it acted directly on DA receptors)",,,
1335988,F,"Antihypertensive activity in Wistar rat assessed as mean arterial pressure at 10 mg/kg, ip measured immediately at 0 min (Rvb = 194.08 +/- 1.962 mmHg)",,,
626035,F,Inhibition of capsaicin-induced vasodilation in orally dosed rhesus monkey at 5.5 uM plasma level,,,
909420,F,Anticoagulant activity in Rattus norvegicus Wistar (rat) diabetic-hyperlipidemic model assessed as decrease in TFa activity in aorta measuring clotting time at 10.91% administered through feeding measured after 12 weeks (Rvb = 36.25 +/- 1.39 secs),,,
314632,F,Concentration of C22:2 ceramide in liver of D-galactosamine treated rats after 18 hr at dose of 1 g/kg intraperitoneally,,,
169740,F,"Amount of milk ingested after the 120 min methamphetamine-challenges, produced by the compound at 0.312 mg/kg in fasted rats",,,
615712,F,Antilipolytic activity in po dosed rat assessed as reduction plasma free fatty acids levels,,,
170803,F,"Percent decrease in angiotensin I pressor response was measured in rat, administered intravenously at dose 0.010 mg/kg",,,
189479,F,Percentage of animals emitting 50 presses on the LSD appropriate lever during the test period in rat at 0.02 mg/kg(0.046 uM/kg),,,
1912425,B,Binding affinity to wild-type TTR (unknown origin) assessed as induction of chemical shift at L58 residue at 0.6:1 to 1:1 ratio of compound to protein by 2D TROSY [1H-15N] spectroscopy,2D TROSY [1H-15N] spectroscopy,nuclear magnetic resonance,BAO_0000160
1864118,B,Inhibition of human recombinant full length N-terminal GST tagged p38alpha expressed in baculovirus infected Sf9 cells using p38 peptide as substrate measured after 60 mins in presence of ATP by ADP-Glo kinase assay,ADP-Glo kinase assay,ADP Glo Kinase Assay,BAO_0000690
1558050,B,Inhibition of BRPF3 (unknown origin) by Alpha Screen assay,Alpha Screen assay,alphascreen,BAO_0000130
1750677,B,Binding affinity to human partial length BRD3 bromodomain 2 (G306 to P416 residues) expressed in bacterial expression system by BROMOscan assay,BROMOscan assay,,
1729907,B,Inhibition of recombinant human JAK3 (781 to 1124 residues) expressed in insect cells using 5FAM-GEEPLYWSFPAKKK-NH2 as substrate after 10 mins by caliper assay,caliper assay,,
1551515,B,Inhibition of human EGFR preincubated for 10 mins followed by addition of FAM-labeled peptide and incubated for 10 mins by Caliper motility shift assay,Caliper motility shift assay,,
1934860,B,Inhibition of human biotinylated VEGF-A165 binding to recombinant human NRP1 receptor at 100 uM after 2 hrs by chemiluminescence analysis relative to control,chemiluminescence analysis,chemiluminescence,BAO_0000051
1613700,B,Inhibition of activated protein C (unknown origin) at 37 degC by chromogenic substrate assay,chromogenic substrate assay,,
1717988,B,Activation of ABCG2 ATPase activity (unknown origin) expressed in baculovirus infected high5 cell membranes assessed as enzyme activity at 56 nM after 20 mins by ascorbic acid ammonia molybdate reaction based colorimetric assay relative to control,colorimetric assay,,
2119431,B,Inhibition of vanadate sensitive BCRP ATPase activity in human S1-M1-80 cell membranes preincubated for 30 mins followed by ATP addition and measured after 1 hr by colorimetric assay,colorimetric assay,,
1806100,B,Displacement of biotinylated AVPF from N-terminal His tagged recombinant human XIAP-BIR3 Lys311Ser mutant expressed in Escherichia coli BL21(DE3) cells incubated for 8 hrs by DELFIA,DELFIA,,
2032025,B,Inhibition of human COX2 assessed as reduction in PGF2alpha formation using arachidonic acid as substrate incubated for 10 mins by ELISA,ELISA,ELISA,BAO_0000134
1873995,B,Activation of YFP-tagged TLR2 (unknown origin) expressed in HEK293 cells assessed as induction of IL8 secretion at 8 ug/mL incubated for 16 to 18 hrs by ELISA,ELISA,ELISA,BAO_0000134
1660709,B,Inhibition of TLR9 in human PBMC assessed as reduction in ODN2216-stimulated IFNalpha expression at 1 to 10 uM by ELISA,ELISA,ELISA,BAO_0000134
1825833,B,"Inhibition of recombinant human full-length N-terminal His6-tagged Src expressed in Sf21 insect cells at 1000 nM using poly (Glu, Tyr)4:1 as substrate measured after 1 hr by ELISA relative to control",ELISA,ELISA,BAO_0000134
1651980,B,Poison activity at recombinant human topoisomerase-2alpha expressed in Saccharomyces cerevisiae JEL1 harboring topoisomerase1 deletion mutant assessed as increase in double stranded DNA cleavage at 1 mM using supercoiled pBR322 DNA as substrate preincubated for 1 to 5 mins followed by substrate addition measured after 6 mins by ethidium bromide staining based agarose gel electrophoresis,ethidium bromide staining based agarose gel electrophoresis,ethidium bromide DNA staining,BAO_0002474
1651980,B,Poison activity at recombinant human topoisomerase-2alpha expressed in Saccharomyces cerevisiae JEL1 harboring topoisomerase1 deletion mutant assessed as increase in double stranded DNA cleavage at 1 mM using supercoiled pBR322 DNA as substrate preincubated for 1 to 5 mins followed by substrate addition measured after 6 mins by ethidium bromide staining based agarose gel electrophoresis,ethidium bromide staining based agarose gel electrophoresis,agarose gel,BAO_0010020
1797285,B,Binding affinity to human langerin expressed in human Raji cells preincubated with Cy5 conjugated compound for 2 hrs followed by washing and measured by flow cytometric analysis,flow cytometric analysis,flow cytometry,BAO_0000005
1652717,B,Inhibition of ATP citrate lyase in snail expressing HMLE cells assessed as suppression of cancer stemness by measuring CD44 positive/negative and CD24 positive cells at 10 uM after 48 hrs by flow cytometry (Rvb = 4.85 %),flow cytometry,flow cytometry,BAO_0000005
1691517,B,Inhibition of chymotrypsin-like activity of 20S proteasome in human HL60 cells using Suc-LLVYaminoluciferin as substrate at 2 uM after 2 hrs by fluorescence analysis,fluorescence analysis,fluorescence method,BAO_0000046
2092323,B,Inhibition of recombinant human N-terminal His-tagged HDAC11 expressed in baculovirus infected Sf9 insect cells using Ac-Arg-His-Lys(Ac)-Lys(Ac)-AMC as substrate measured after 30 mins by fluorescence assay,fluorescence assay,fluorescence method,BAO_0000046
1747466,B,Antagonist activity at recombinant human eGFP-fused Ahr expressed in yeast cells co-expressing ARNT assessed as inhibition of benzo(a)pyrene-induced Ahr activation at 1 uM measured after 18 hrs by fluorescence assay,fluorescence assay,fluorescence method,BAO_0000046
1904292,B,"Inhibition of human testis ACE C-domain lacking unique O-glycosylated region, transmembrane anchor and cytoplasmic tail expressed in CHO cells using Z-FHL as substrate by fluorescence based assay",fluorescence based assay,fluorescence method,BAO_0000046
2052178,B,Inhibition of HDAC1 in human HeLa nuclear extract using Boc-Lys(Ac)-AMC as substrate measured after 2 hrs by fluorescence based assay,fluorescence based assay,fluorescence method,BAO_0000046
2053483,B,Inhibition of IDH2 R172K mutant (unknown origin) assessed as reduction in NADPH consumption using alpha-ketoglutarate and NADPH as substrate preincubated with enzyme for 15 mins followed by substrate addition by fluorescence based assay,fluorescence based assay,fluorescence method,BAO_0000046
1807970,B,Inhibition of HDAC10 (unknown origin) using Ac-ArgThr- Lys(Ac)Lys(Ac)-AMC as substrate preincubated for 5 mins followed by substrate addition and measured after 60 mins by fluorescence based assay,fluorescence based assay,fluorescence method,BAO_0000046
2112640,B,Inhibition of N-terminal GST-tagged full length human HDAC6 expressed in baculovirus-infected Sf9 cells using Boc-Lys (acetyl)-AMC as substrate preincubated for 5 mins followed by substrate addition and further incubated for 30 mins by fluorescence based assay,fluorescence based assay,fluorescence method,BAO_0000046
2089693,B,Inhibition of recombinant human HDAC1 using Z-(Ac)Lys-AMC as substrate after 90 mins by fluorescence based micro plate assay,fluorescence based micro plate assay,fluorescence method,BAO_0000046
1877072,B,Displacement of fluorescein labelled Puma-BH3 peptide from His-tagged-TEV fused human Mcl-1 incubated for 2 hrs by fluorescence polarization assay,fluorescence polarization assay,fluorescence polarization,BAO_0000003
2146163,B,Displacement of GDP-BODIPY probe from BTN3A1 full intracellular domain (unknown origin) at 0.1 mM measured after 60 mins by fluorescence polarization assay,fluorescence polarization assay,fluorescence polarization,BAO_0000003
1844860,B,Displacement of 6N-FAM from human LRH1 LBD (299 to 541 residues) expressed in Escherichia coli BL21 pLysS by competitive binding based fluorescence polarization assay,fluorescence polarization assay,fluorescence polarization,BAO_0000003
1704689,B,Inhibition of human recombinant MMP-9 catalytic domain (107 to 449 residues) expressed in Escherichia coli using fluorogenic MOCAc-Pro-Leu-Gly-Leu-A2pr(Dnp)-Ala-Arg-NH2 as substrate at 10 uM by fluorescence spectrophotometric analysis,fluorescence spectrophotometric analysis,fluorescence method,BAO_0000046
2014877,B,Binding affinity to C-terminal 8-His tagged human MMP-9 hemopexin-like domain (Ala20 to Asp707 residues) expressed in 293E cells by fluorescence spectroscopy,fluorescence spectroscopy,fluorescence method,BAO_0000046
2119620,B,Inhibition of recombinant human C-terminal His-tagged HDAC9 (604 to 1066 residues) expressed in baculovirus expression system using Nepsilon-Trifluoroacetyl L-lysine substrate by fluorescent microplate reader assay,fluorescent microplate reader assay,fluorescence method,BAO_0000046
2184782,B,Inhibition of human recombinant HDAC6 using BML-AK511 as substrate incubated for 60 mins by fluorimetric assay,fluorimetric assay,fluorescence method,BAO_0000046
2157377,B,Positive allosteric modulator activity at human MRGPRX1 transfected in HEK293 cells in presence of BAM8-22 by Fulo4AM dye based FLIPR assay,Fulo4AM dye based FLIPR assay,FLIPR Membrane Potential Assay Kit,BAO_0003088
2112257,B,Inhibition of human TDO expressed in HEK293-EBNA cells assessed as reduction in kynurenine formation using tryptophan as substrate at 6.25 uM incubated for 24 hrs by HPLC analysis relative to control,HPLC analysis,HPLC System,BAO_0002733
1621810,B,Inhibition of OGT (unknown origin) assessed as reduction in GlcNAc transfer to CKII peptide at 100 uM incubated for 60 mins by HPLC method,HPLC method,HPLC System,BAO_0002733
2086797,B,Inhibition of Aurora A (unknown origin) incubated for 1 hrs by HTRF assay,HTRF assay,homogeneous time resolved fluorescence,BAO_0000002
2069831,B,Agonist activity at human RXRalpha transfected in human HEK293T cells co-expressing pFR/pRL-Luc at 30 uM incubated for 14 to 16 hrs by hybrid reporter gene assay relative to bexarotene,hybrid reporter gene assay,reporter gene assay,BAO_0003006
2076633,B,Activation of FoxO3A in human MDA-MB-231 cells after 72 hrs by immunoblot analysis,immunoblot analysis,immunoassay,BAO_0000129
2195904,B,Inhibition of UCHL1 in human HEK293 cells using HA-Ub-VME as substrate at 0.1 to 10 uM incubated for 1 hr by immunoblotting analysis,immunoblotting analysis,immunoassay,BAO_0000129
1659301,B,Binding affinity to DYRK1A in human U251 cell lysate preincubated for 1 hr followed by incubation at 54 degreeC for 3 mins by isothermal dose-response fingerprint assay,isothermal dose-response fingerprint assay,,
1670804,B,Binding affinity to recombinant human GFP-fused ERalpha LBD (301 to 553 residues) expressed in Escherichia coli BL21(DE3) in presence of 17beta-estradiol by ITC,ITC,isothermal titration calorimetry,BAO_0000428
1644719,B,Binding affinity to full length recombinant human N-terminal His8-tagged Cyclophilin A (1 to 169 residues) expressed in Escherichia coli BL21(DE3) assessed as change in entropy at 225 to 300 uM by ITC,ITC,isothermal titration calorimetry,BAO_0000428
1816940,B,Binding affinity to recombinant human carbonic anhydrase 13 expressed in Escherichia coli expression system assessed as kinetic gibbs free energy change by ITC method,ITC method,isothermal titration calorimetry,BAO_0000428
2150721,B,Inhibition of TrKC (unknown origin) incubated for 120 mins in presence of 33P-ATP,,,
2210648,B,Reversible inhibition of N-terminal His-tagged human recombinant glycolate oxidase expressed in Escherichia coli BL21 (DE3) cells assessed as enzyme recovery using glycolate as substrate at 100 times of IC50 concentration preincubated for 30 mins followed by substrate addition and measured every 60 sec for 15 mins by jump-dilution based Amplex red and horseradish peroxidase fluorescence assay,jump-dilution based Amplex red and horseradish peroxidase fluorescence assay,fluorescence method,BAO_0000046
2210648,B,Reversible inhibition of N-terminal His-tagged human recombinant glycolate oxidase expressed in Escherichia coli BL21 (DE3) cells assessed as enzyme recovery using glycolate as substrate at 100 times of IC50 concentration preincubated for 30 mins followed by substrate addition and measured every 60 sec for 15 mins by jump-dilution based Amplex red and horseradish peroxidase fluorescence assay,jump-dilution based Amplex red and horseradish peroxidase fluorescence assay,Amplex red reagent,BAO_0001217
2210648,B,Reversible inhibition of N-terminal His-tagged human recombinant glycolate oxidase expressed in Escherichia coli BL21 (DE3) cells assessed as enzyme recovery using glycolate as substrate at 100 times of IC50 concentration preincubated for 30 mins followed by substrate addition and measured every 60 sec for 15 mins by jump-dilution based Amplex red and horseradish peroxidase fluorescence assay,jump-dilution based Amplex red and horseradish peroxidase fluorescence assay,dilution method,BAO_0002418
1778489,B,Binding affinity to partial length human PDGFRA (V575 to D1002 residues) expressed in mammalian expression system by KdELECT assay,KdELECT assay,,
1735937,B,Inhibition of human PIP5K2C expressed in mammalian expression system assessed as remaining enzyme activity at 10 uM by kinome scan assay,kinome scan assay,KINOMEScan assay,BAO_0003011
1578804,B,Inhibition of human ROCK2 (1 to 431 amino acid residues) assessed as enzyme activity at 10 uM by KINOMEScan assay,KINOMEScan assay,KINOMEScan assay,BAO_0003011
1646002,B,Inhibition of human RIPK1 (M1 to K305 residues) expressed in bacterial expression system assessed as residual activity at 1 uM by KINOMEscan assay relative to control,KINOMEscan assay,KINOMEScan assay,BAO_0003011
1679271,B,Binding affinity to partial length human HIPK1 (M146 to I555 residues) expressed in mammalian expression system assessed as unbound drug level at 300 nM by KINOMEscan assay,KINOMEscan assay,KINOMEScan assay,BAO_0003011
1775920,B,Inhibition of full length human MARK3 (M1 to L729 residues) expressed in bacterial expression system assessed as residual activity at 5 uM by KINOMEscan assay relative to control,KINOMEscan assay,KINOMEScan assay,BAO_0003011
1681112,B,Inhibition of human FLT3 K663Q mutant (V592 to Y969 residues) expressed in bacterial expression system assessed as residual activity at 1 uM by Kinomescan assay relative to control,Kinomescan assay,KINOMEScan assay,BAO_0003011
1773592,B,Binding affinity to wild-type human partial length ARK5 (E25 to I332 residues) expressed in bacterial expression system assessed as residual binding level at 1 uM by Kinomescan method relative to control,Kinomescan method,KINOMEScan assay,BAO_0003011
1674858,B,Inhibition of wild-type human ACVR2A (V171 to T499 residues) expressed in bacterial expression system assessed as residual activity at 1 uM by Kinomescan method relative to control,Kinomescan method,KINOMEScan assay,BAO_0003011
1857287,B,Binding affinity to wild-type human partial length NEK10 (L488 to R809 residues) expressed in mammalian expression system assessed as residual binding level at 1 uM by Kinomescan method relative to control,Kinomescan method,KINOMEScan assay,BAO_0003011
1880923,B,Binding affinity to wild-type human partial length CAMKK1 (R65 to E414 residues) expressed in bacterial expression system assessed as residual binding level at 1 uM by Kinomescan method relative to control,Kinomescan method,KINOMEScan assay,BAO_0003011
1692973,B,Inhibition of wild-type human full length CDK3 (M1 to H305 residues) expressed in Escherichia coli BL21 assessed as residual activity at 1000 nM after 30 mins by Kinomescan method relative to control,Kinomescan method,KINOMEScan assay,BAO_0003011
1792490,B,Binding affinity to wild-type human partial length MLK3 (I77 to W399 residues) expressed in bacterial expression system assessed as remaining unbound target protein level at 1000 nM by Kinomescan method relative to control,Kinomescan method,KINOMEScan assay,BAO_0003011
1751032,B,Binding affinity to wild-type human partial length EPHB3 (Q599 to T928 residues) expressed in Escherichia coli BL21 at 1 uM by Kinomescan method relative to control,Kinomescan method,KINOMEScan assay,BAO_0003011
1751313,B,Binding affinity to wild-type human partial length TAOK2 (M1 to A320 residues) expressed in HEK293 cells at 1 uM by Kinomescan method relative to control,Kinomescan method,KINOMEScan assay,BAO_0003011
1773635,B,Binding affinity to wild-type human partial length CDK8 (M1 to T360 residues) expressed in bacterial expression system assessed as residual binding level at 1 uM by Kinomescan method relative to control,Kinomescan method,KINOMEScan assay,BAO_0003011
1887987,B,Inhibition of wild-type human partial length DDR1 (R565 to V876 residues) expressed in bacterial expression system at 1 uM by Kinomescan method relative to control,Kinomescan method,KINOMEScan assay,BAO_0003011
